video_id,title,publishedAt,channelId,channelTitle,categoryId,trending_date,tags,view_count,likes,dislikes,comment_count,thumbnail_link,comments_disabled,ratings_disabled,description
"1fSY8hJnhF0","ENCHANTING LEVEL 999,999 Thanos GAUNTLET in Minecraft (Insane Craft)","2021-06-20T23:00:03Z","UCke6I9N4KfC968-yRcd5YRg","SSundee","20","21.24.06","[none]","3351817","156888","2005","14167","https://i.ytimg.com/vi/1fSY8hJnhF0/default.jpg","False","False","We enchant Thanos's OP armor to become IMMORTAL in Minecraft Insane Craft🔔 Subscribe & click the bell!  https://www.youtube.com/user/SSundee?sub_confirmation=1👍 Hit the Thumbs Up if you liked this video! 🤖 My Friends! 🤖@Nicovald @Henwy @Sigils @Biffle @Spark Universe @JeromeASF ❗️ Follow Me! ❗️Twitter: https://www.twitter.com/SSundeeDiscord: https://discord.gg/SSundeeInstagram: https://instagram.com/ssundeeytFacebook:  https://www.facebook.com/pages/SSundee/200010033358843👨🏻‍🍳 Awesome Video Editor ► Russellhttps://www.youtube.com/russelledits👨🏼‍🎨 Awesome Thumbnail Maker ► Flashhttps://www.youtube.com/channel/UCLy01oVLarj7RNQm52jnGKw🎨 Awesome Animator ► Davidhttps://www.youtube.com/channel/UCxSSIQevKsx2bFc_Gn4WAMg?view_as=subscriber🎶 Music by Ninety9 ► LivesTobu - Such FunVideo Link: https://www.youtube.com/watch?v=d3Oc26AFDdUChannel: https://99l.tv/SubscribeDownload the album! https://99l.tv/Levelup-iThanks for watching!"
"z05aKDlXb-g","#5 HAWKS at #1 76ERS | FULL GAME HIGHLIGHTS | June 20, 2021","2021-06-21T02:44:19Z","UCWJ2lWNubArHWmf3FIHbfcQ","NBA","17","21.24.06","Basketball|G League|NBA|game-0042000207","1758612","16759","695","6277","https://i.ytimg.com/vi/z05aKDlXb-g/default.jpg","False","False","#5 HAWKS at #1 76ERS | FULL GAME HIGHLIGHTS | June 20, 2021Led by Kevin Huerter’s Playoff career-high 27 PTS, the No. 5 seed Atlanta Hawks defeated the No. 1 seed Philadelphia 76ers, 103-96, in Game 7. Trae Young added 21 PTS (5-23 FG) and 10 AST for the Hawks in the victory, while Joel Embiid led all scorers with 31 PTS and 11 REB for the 76ers. The Hawks have now closed out this best-of-seven series, 4-3, and will advance to the Eastern Conference Finals to face the No. 3 seed Milwaukee Bucks.Next Game:Atlanta Hawks at Milwaukee Bucks - June 23 at 8:30pm/et on TNT0:00 - 1Q1:45 - 2Q3:40 - 3Q5:58 - 4QSubscribe to the NBA: https://on.nba.com/2JX5gSNFull Game Highlights Playlist: https://on.nba.com/2rjGMgeFor news, stories, highlights and more, go to our official website at https://app.link.nba.com/e/NBA_siteGet NBA LEAGUE PASS: https://nba.app.link/nbaleaguepass5"
"oxmlmqGC0zk","One Secret Entrance EVERY Minecraft Player NEEDS!","2021-06-20T16:00:21Z","UCKYb5XBe-5OSEgLijLSoDtw","UnspeakableGaming","20","21.24.06","minecraft|unspeakablegaming|unspeakable|mini game|mod|gaming|game|custom|map|crazy|spotlight|showcase|challenge|roleplay|modded|mods|games|maps|secret|redstone|command|mini-game|gameplay|playthrough|tutorial|traps|trolling|glitch|funny|moments|craziest|prank|pranks|no cursing|no swearing|creations|facts|minigame|how to|house|parody|troll|adventure|comedy|video|unspeakablegaming minecraft|troll smp|build battle|base battle|youtuber battle|hidden bases","652752","23910","636","2677","https://i.ytimg.com/vi/oxmlmqGC0zk/default.jpg","False","False","NEW MERCH! - https://www.unspeakable.com/PLAY NEW GAMES! - https://www.unspeakable.com/pages/play-gamesFOLLOW ME! - https://www.unspeakable.com/pages/linksCHECK OUT @BeckBroJack   AND @ASWDFZXCVBHGTYYN !PLEASE leave a like & subscribe this video was expensive!! THANK YOU! I love tacos#Unspeakable#Gaming#minecraft"
"QBh2bSrlv2I","I am finally ready to speak out.. My truth..","2021-06-19T22:24:45Z","UCZPuxHW-V2DNrc9lo6fek3g","OH TRE TRE TRE","22","21.24.06","oh tre tre tre i am finally ready to speak out.. my truth..|i am finally ready to speak out.. my truth..|alondradessy we broke up.|elsy guevara|benny soliven|tre carter|tre carter cheating|Ace family|The ace family|Ace fam|This is ls|Through our eyes|Murillo twins|Louies life|Us always|The aguilars|Jenny69|Reece and ray|J cool|Juju and des|Kb and Karla","311187","7750","5285","3406","https://i.ytimg.com/vi/QBh2bSrlv2I/default.jpg","False","False",""
"bDcBF51yM_M","I found a famous meme location in Geoguessr... 😳","2021-06-20T17:00:28Z","UCWBWgCD4oAqT3hUeq40SCUw","Sambucha","20","21.24.06","[none]","317918","24449","783","256","https://i.ytimg.com/vi/bDcBF51yM_M/default.jpg","False","False","Twitch: http://twitch.tv/sambucha#streamer #geoguessr #shorts"
"qXYz0jYdayo","TITANFALL 2 MAKES NO SENSE","2021-06-20T15:00:18Z","UCs3uTN9G4MnZGOfYWoSs9mA","Macro","20","21.24.06","titanfall 2 makes no sense|titanfall makes no sense|titanfall logic|titanfall 2|titanfall 3|respawn|ea|how to titanfall|titanfall ddos|titanfall server|save titanfall|titanfall funny moments|titanfall funny|macro|mokeysniper|titanfall sequel|titanfall update|best titan|worst titan|smart pistol|makes no sense|titanfall campaign|jack cooper|bt|blacklist|multiplayer|apex legends|octane|stim|grapple|movement|wallrun|scorch|pilot|hacker|blisk|phase shift|ash","398244","24809","385","2590","https://i.ytimg.com/vi/qXYz0jYdayo/default.jpg","False","False","Titanfall 2 is a beautiful game, but that doesn't mean it's flawless. Here's another episode of MAKES NO SENSE►BUFF MIRAGE MERCH: https://crowdmade.com/collections/macro►TWITCH: https://www.twitch.tv/Macro►TWITTER: https://twitter.com/TheMacroShow►INSTA: https://instagram.com/TheMacroShow►DISCORD: https://discord.gg/macro►MY 2ND CHANNEL: https://www.youtube.com/channel/UCSzBfLmM-DswAOKzOv8eqbASub to @Mokeysniper More detailed videos about the situation by @Upper Echelon Gamers: https://www.youtube.com/watch?v=hjDkUu-wXCUhttps://www.youtube.com/watch?v=UQ4HuBpeI4IThumbnail art by @Mahnster Art: https://www.instagram.com/mahnsterart/#Titanfall2 #MakesNoSense #SaveTitanfall"
"mMx_tvAT_9I","Customer Says He Can't Get The Rotor Off!","2021-06-20T20:12:26Z","UCtAGzm9e_liY7ko1PBhzTHA","South Main Auto Repair LLC","2","21.24.06","[none]","267634","18147","81","3247","https://i.ytimg.com/vi/mMx_tvAT_9I/default.jpg","False","False","In this video I have a look at a guys Chevrolet Silverado. He states he can not get the front brake rotor off no matter how much he beats on it. Let's have a look. -Enjoy!If an SMA Video has helped you out please consider giving using Patreon to help support us. The videos take real time to create and pull us away from real work that pays our bills. CLICK HERE: https://www.patreon.com/southmainautoCHECK OUT OUR SMA SWAG STORE! Go on Teespring and get your very own SMA merch! https://teespring.com/stores/the-sma-storeIf you don't like Patreon feel free to use the PayPal Me link: https://www.paypal.me/SouthMainAutoThe South Main Auto Amazon Store: https://www.amazon.com/shop/southmainautorepairavocaAES Wave Automotive Diagnostic Tools: https://www.aeswave.com/cart.php?m=affiliate_go&affiliateID=2525b91fc8e906e8215984074c9d9e8f&go=https://www.aeswave.com/Miscellaneous-p9347.htmlThank you for all the continuing support!--Eric & Vanessa O.Feel like sending some swag to SMA because you love the videos but don't know where to send it?Just ship it here:South Main Auto Repair47 S. Main StPO Box 471Avoca, NY 14809Disclaimer:Due to factors beyond the control of South Main Auto Repair, it cannot guarantee against unauthorized modifications of this information, or improper use of this information. South Main Auto Repair assumes no liability for property damage or injury incurred as a result of any of the information contained in this video. South Main Auto Repair recommends safe practices when working with power tools, automotive lifts, lifting tools, jack stands, electrical equipment, blunt instruments, chemicals, lubricants, or any other tools or equipment seen or implied in this video. Due to factors beyond the control of South Main Auto Repair, no information contained in this video shall create any express or implied warranty or guarantee of any particular result. Any injury, damage or loss that may result from improper use of these tools, equipment, or the information contained."
"giLuKkTahRU","Hermitcraft 8: 1 - The first 100 Days of HermitCraft","2021-06-19T17:00:31Z","UCZ9x-z3iOnIbJxVpm1rsu2A","iskall85","20","21.24.06","hermitcraft|minecraft|hermitcraft 8|hermitcraft season 8|iskall hermitcraft|hermitcraft iskall|base building minecraft|hermitcraft 8 iskall|100 days in minecraft|100 days hermitcraft|hermitcraft 100 days|lukethenotable|geminitay|pearlesentmoon|hermit craft|hermitcraft 8 ip|hermitcraft 8 server|hermitcraft smp|best smp minecraft|smp minecraft|hermits|hermits minecraft|minecraft hermitcraft|minecraft hermitcraft 8|100 days in hermitcraft","1272545","80491","522","3794","https://i.ytimg.com/vi/giLuKkTahRU/default.jpg","False","False","Hermitcraft 8: 1 - The first 100 Days of HermitCraftHermitCraft Season 8 episode 1! Follow iskall on his journey in the first 100 days of the season!Hermitcraft Season 8 SEED: -7381235180058670651MAKE SURE YOU CLICK THE 🔔 AND SUBSCRIBE!▬▬▬▬▬▬▬▬▬▬▬▬▬TWITTER: http://www.twitter.com/iskall85LIVE STREAMS: https://www.twitch.tv/iskall85▬▬▬▬▬▬▬▬▬▬▬▬▬Play MINECRAFT in the best community ever! Join my Patreon today, loads of different servers to play on and a massive family of friends!► http://www.patreon.com/iskall85▬▬▬▬▬▬▬▬▬▬▬▬▬Take a moment to browse the other hermits channels, found in a list below.Hermitcraft Websitehttp://www.hermitcraft.com/Hermitcraft Subreddit:https://www.reddit.com/r/HermitCraft/▬▬▬▬▬▬▬▬▬▬▬▬▬#minecraft#hermitcraft#iskall85"
"V1Ft2w0Cf0c","ASMR Fast 5 Minute Cranial Nerve Exam","2021-06-20T19:17:02Z","UCpHS-w6UrxBPX5UXLMmhJ1A","Abby ASMR","22","21.24.06","[none]","155395","5387","129","324","https://i.ytimg.com/vi/V1Ft2w0Cf0c/default.jpg","False","False","5 minute cranial nerve exam lets go! I’d say lately I get the most tingles from fast paced shorter videos that are jam packed with triggers 😴 I love the 1 minute ASMR trend and was particularly inspired by ASMR Kenshi, I have his fast videos on repeat! I decided to do a 5 minute version because 1 minute is always so short! Let me know if you'd like to see more maybe for a series :) Sleep well 💤If you haven't already, check out ASMR Kenshihttps://www.youtube.com/watch?v=LZn77ZuOQ6s&t=0sGoodnight xInstagram ▷ https://www.instagram.com/abbyasmrtistDonations ▷ https://www.paypal.me/abbyasmr11 Only if you feel the need to ♡▼ Upload Schedule: Sunday & Wednesday @ 9pm CET ▼ Business Inquiries: abbyasmr11@gmail.comThank you ❤︎ASMR has played such a significant role in my life, to help me manage anxiety and feel a sense of calm and comfort. Whether you've been here for a while or only just arrived, thank you for watching & supporting. I hope I can help promote a relaxing state of physical and mental well-being."
"zxSKFaYIuts","MY LITTLE SISTER OPENED A KISSING BOOTH!!","2021-06-19T23:13:50Z","UC56D-IHcUvLVFTX_8NpQMXg","Brent Rivera","24","21.24.06","[none]","4099740","481693","4919","39831","https://i.ytimg.com/vi/zxSKFaYIuts/default.jpg","False","False","LIKE AND COMMENT to be next week's shoutout! ✩new relatable hoodies !! ✩ www.relatableapparel.comTYPO: **Hiram Romero Subscribe to the group channel: @Amp World     Follow the squad:Ben Azelart -  @benazelart   Lexi Hensler @Lexi Hensler  Stokes Twins: @Stokes Twins  Lexi Rivera - @Alexa Rivera  Jeremy Hutchins:  @jeremyhutchins   Andrew Davila - @Andrew Davila  Dom Brack -  @Dominic Brack  Mason Fulp: @Mason Fulp Pierson: @pierson hang out with me on social media:SnapChat, Add me: TheBrentRiveraInstagram: @BrentRiveraTwitter: @BrentRiveraFacebook: @BrentRiveraTikTok: @BrentRiveraI have all rights to use this audio in this video according to Final Cut Pro's/YouTube's terms of use."
"9yegdG8F8oM","Returning to an RPG that you haven't played in a while","2021-06-19T14:00:14Z","UCVIFCOJwv3emlVmBbPCZrvw","Joel Haver","1","21.24.06","Joel Haver|Trent Lenkarski|Animation|RPG|Dax Flame|Elizabeth Boudreau|Nicholas Hourihan|Mason Carter","1522426","208001","910","9146","https://i.ytimg.com/vi/9yegdG8F8oM/default.jpg","False","False","Adventure waits.Trent's Channel - @Trent Lenkarski Dax's Channel - @Daxflame Subscribe for weekly short films.More Animations - https://www.youtube.com/playlist?list=PLKtIcOP0WvJDZemPYZZQSqotCgpps5DbXSupport - Patreon: https://patreon.com/joelhaverPaypal: https://bit.ly/2ZI7uffMerch - https://joelstuff.storeSocial - Instagram: https://www.instagram.com/joelhaverTwitter: https://twitter.com/joelhaverDrawings: https://www.instagram.com/joeldrawsandwriteshaverLetterboxd: https://letterboxd.com/joelhaver"
"YzXoH8Lsetc","$250,000 Dodgeball Tournament! Ft. @FaZe Clan  @RDCworld1  @2HYPE  @AMP  I HoH Showdown!","2021-06-19T01:26:23Z","UCqQo7ewe87aYAe7ub5UqXMw","House of Highlights","17","21.24.06","showdown|hoh|hoh dodgeball|faze clan dodgeball|amp dodgeball|rdc dodgeball|2hype dodgeball competition|2hype|rdcworld1|faze jarvis|faze clan|temperrr|faze adapt|deestroying|supremedreams|jesser|cashnasty|cashnasty reacts|zackttg|duke dennis|dodgeball|agent 00|amp duke|amp davis|adinross amp|faze house|hoh showdown","2434461","79696","2066","6252","https://i.ytimg.com/vi/YzXoH8Lsetc/default.jpg","False","False","🚨$250K DODGEBALL TOURNEY LIVE FROM WARNER BROS STUDIOS IN LA 🚨🔥LIMITED EDITION SHOWDOWN JERSEYS: http://bit.ly/YTMerch🍕SHOUTOUT TO OUR SPONSOR  @Pizza Hut  🍕#HoHShowdown #FaZeClan #RDCWorld #2Hype #AMP #Dodgeball"
"GicrV3yVMNo","How the sounds of Friday Night Funkin' were actually made 2","2021-06-19T15:35:05Z","UCdVHWfWPwwiOzMHpcwEATmA","Davidlap","24","21.24.06","how the sounds of friday night funkin were actually made|friday night funkin sounds|friday night funkin|sound effects|sounds|gaming|friday night sounds|davidlap","3314162","82881","3101","6114","https://i.ytimg.com/vi/GicrV3yVMNo/default.jpg","False","False","Hi guys many of you have asked me to recreate other sounds from the game Friday Night Funkin' so I tried! I haven't uploaded for long because processing them was very difficult. I also added a few words here and there. I have to say it's a lot of fun to talk using those effects haha. I hope you enjoyed the video, don't forget to leave a comment ;)Friday Night Funkin 'is a very cool game that you can play here: https://www.newgrounds.com/portal/view/770371Kawai Sprite made the cool music and the voices of the game:https://www.youtube.com/channel/UC_fpxqB2Rb3hHP6e6kiqVbATricky mod:https://gamebanana.com/gamefiles/17466my Instagam: https://www.instagram.com/davidlap_insta/?hl=itPatreon: https://www.patreon.com/DavidlapSpotify: https://open.spotify.com/artist/0C8A5VNmA5oOamZ0eCOVUXiTunes: https://music.apple.com/it/artist/davidlap/1565605915"
"BWWEnU9Qas0","#4 CLIPPERS at #1 SUNS | FULL GAME HIGHLIGHTS | June 20, 2021","2021-06-20T21:58:45Z","UCWJ2lWNubArHWmf3FIHbfcQ","NBA","17","21.24.06","Basketball|G League|NBA|game-0042000311","2279066","19103","902","4067","https://i.ytimg.com/vi/BWWEnU9Qas0/default.jpg","False","False","#4 CLIPPERS at #1 SUNS | FULL GAME HIGHLIGHTS | June 20, 2021Led by Devin Booker’s 40 PTS, 13 REB and 11 AST, the No. 2 seed Phoenix Suns defeated the No. 4 seed LA Clippers, 120-114, in Game 1. Deandre Ayton added 20 PTS and 9 REB for the Suns in the victory, while Paul George tallied 34 PTS, 4 REB and 5 AST for the Clippers. The Suns lead this best-of-seven series, 1-0.Next Game:LA Clippers at Phoenix Suns - June 22 at 9pm/et on ESPN0:00 - 1Q1:53 - 2Q4:37 - 3Q7:00 - 4QSubscribe to the NBA: https://on.nba.com/2JX5gSNFull Game Highlights Playlist: https://on.nba.com/2rjGMgeFor news, stories, highlights and more, go to our official website at https://app.link.nba.com/e/NBA_siteGet NBA LEAGUE PASS: https://nba.app.link/nbaleaguepass5"
"j_V6PTcCQCc","Golden Buzzer: World Taekwondo Demonstration Team Shocks the Judges - America's Got Talent 2021","2021-06-16T02:57:38Z","UCT2X19JJaJGUN7mrYuImANQ","America's Got Talent","24","21.24.06","Simon Cowell|Howie Mandel|Terry Crews|America's Got Talent|America's Got Talent Best|AGT|AGT Best Auditions|Heidi Klum|Sofia Vergara|New AGT|Full Performance|Season 16|America's Got Talent Season 16|AGT 16|AGT Auditions|Got Talent Auditions|America's Got Talent 2021|AGT 2021|america's got talent auditions|judges|golden buzzer|golden buzzer winner|taekwondo|World Taekwondo Demonstration Team|Karate|Terry Crews Golden Buzzer|Best Golden Buzzer","10302977","289474","3774","17182","https://i.ytimg.com/vi/j_V6PTcCQCc/default.jpg","False","False","The World Taekwondo Demonstration Team delivers a jaw-dropping performance and receives the Golden Buzzer from Terry Crews!» Get The America's Got Talent App: http://bit.ly/AGTAppDownload» Subscribe for More: http://bit.ly/AGTSub» America's Got Talent Tuesdays 8/7c on NBC!» Stream on Peacock: https://pck.tv/3cCQGhHAMERICA'S GOT TALENT ON SOCIALLike AGT: https://www.facebook.com/agtFollow AGT: https://twitter.com/agtAGT Instagram: http://instagram.com/agtFind America's Got Talent trailers, full episode highlights, previews, promos, clips, and digital exclusives here.NBC ON SOCIAL:YouTube: http://www.youtube.com/nbcTwitter: http://Twitter.com/NBCFacebook: http://Facebook.com/NBCInstagram: http://instagram.com/nbcABOUT AMERICA'S GOT TALENTAmerica’s Got Talent, NBC’s No. 1 summer show, with fresh new faces and familiar favorites, along with the excitement, thrills and feel-good performances that viewers have come to love each season. Creator and Executive Producer Simon Cowell is back at the star-studded judges' table with fan-favorite comedian Howie Mandel. Acclaimed actress and international superstar Sofia Vergara joins as a new judge this season alongside returning judge and global fashion icon Heidi Klum.  The dynamic Terry Crews returns as host. With the show open to acts of all ages, America's Got Talent continues to celebrate the variety format like no other show on television. Year after year, America's Got Talent features an impressive array of singers, dancers, comedians, contortionists, impressionists, magicians, ventriloquists and hopeful stars, all vying to win America's hearts and a $1 million prize.America's Got Talent is available now on Peacock, the new streaming service from NBCUniversal. Watch thousands of hours of hit movies and shows, plus daily news, sports, and pop culture updates. Stream now on Peacock.Golden Buzzer: World Taekwondo Demonstration Team Shocks the Judges - America's Got Talent 2021https://youtu.be/j_V6PTcCQCcAmerica's Got Talenthttp://www.youtube.com/user/americasgottalent#AGT #AmericasGotTalent #GoldenBuzzer"
"cq3_E29bUh8","Guessing Minecraft YouTubers Using ONLY Their Gameplay (ft. BadBoyHalo)","2021-06-19T19:38:28Z","UCzMjRlKVO9XIqH_crIFpi6w","Skeppy","20","21.24.06","minecraft|mine craft|minecraft youtuber|pg|family friendly|skeppy|minecraft skeppy|no swearing|no cursing|minecraft trolling|minecraft troll|funny minecraft|minecraft mod|minecraft map|parkour|trolling|troll|roleplay|custom|challenge|glitch moments|skeppy face|try not to laugh|bedwars|skywars|hypixel|dream smp|dream|georgenotfound|sapnap|dream team|badboyhalo|guessing minecraft youtubers|skeppy badboyhalo","1199950","93049","1055","4532","https://i.ytimg.com/vi/cq3_E29bUh8/default.jpg","False","False","Skeppy & BadBoyHalo Guess YouTubers Based on Minecraft Gameplay Get Honey for FREE today ▸ https://joinhoney.com/skeppy Honey finds coupons with one click. Thanks to Honey for sponsoring!Today I got BadBoyHalo to compete with me in one of the HARDEST challenges I think I’ve done so far. BadBoyHalo and I will battle it out to see who can get the most points and identify which YouTuber we are watching JUST based on context clues. This should be pretty easy when it comes to the speedrunnier Dream but I’m a little worried about the rest!!! The creators skins and facecam’s will be completely blurred out - lol sorry TapL - and we will have to guess and rack up as many points as possible to defeat the other. If I got anything out of this challenge it’s that I can always recognize a Mr. Beast video no matter what. The points get SO CLOSE HAHA so make sure to stay tuned until the end to see who the real winner is - hint, I’m actually Quackity’s best friend now. Get LIMITED TIME Merch here!!!https://skeppyshop.com/I Cheated with ONE WAY GLASS in a Building Competition...https://www.youtube.com/watch?v=fiWxNzG5rOwFollow My Twitter 🡆 @SkeppyFollow My Instagram 🡆 @SkeppyI AM GIVING AWAY $1,000 TO A RANDOM SUBSCRIBER SO MAKE SURE YOU ARE SUBSCRIBED :DNot Minecraft, But Water Rises or Minecraft, But Lava Rises, or any other but challenge like that. This is a speed runner / survivalist in Minecraft against a killer / assassin / hitmen but it's BadBoyHalo and I playing the ultimate YouTuber guessing game"
"ggRPnFuu-Qs","Hermitcraft S8 Episode 1:  You Will LOVE This!","2021-06-19T13:51:19Z","UCodkNmk9oWRTIYZdr_HuSlg","GoodTimesWithScar","20","21.24.06","minecraft|minecraft hermitcraft|hermitcraft season 8|hermitcraft season 8 episode 1|hermitcraft s8 episode 1|hermitcraft S8|hermitcraft 8|rmitcraft smp season 8|hermitcraft season 8 scar|hermitcraft S8 scar|hermitcraft season 8 episode 1 scar|hermitcraft season 8 ep 1 scar|ep 1|episode 1|hermitcraft season 8 starter base|wagon|copper|tycoon|base|house|hermitcraft season 8 episode 1 goodtimeswithscar|goodtimeswithscar|scar|hermitcraft season 8 wagon base","848375","72701","241","6276","https://i.ytimg.com/vi/ggRPnFuu-Qs/default.jpg","False","False","Hermitcraft season 8 episode 1! We start out big with our Minecraft let's play ep 1 on the Hermitcraft S8 server with a massive starter base with the 1.17 copper as a roof for a Minecraft steampunk wagon house. The wagon base is for our new character the tycoon, who runs a wagon trading business with dreams of building a mega cloud city! The wagon will take a huge resource grind to make with all the copper needed. So enjoy all the fun and craziness that is involved to create it for the first episode of the new season. I hope you enjoy it!---------------------------------------------------------Hermitcraft SMP - season 8 info:We have 2 new Hermitcraft members for the new season: *GeminiTay: https://www.youtube.com/user/GeminiTard*PearlescentMoon: https://www.youtube.com/c/PearlescentMoonWe are all playing and building on one big Hermit island together with proximity voice mod. Seed: -7381235180058670651For more information and links to all things Hermitcraft, follow the link to the Hermitcraft website: https://hermitcraft.com/------------------------------------------------------My Links and stuff:* Patreon: https://www.patreon.com/user?u=21298347* T-Shirt Shop: https://teespring.com/stores/goodtimeswithscar* Twitter: http://twitter.com/#!/GTWScar* Twitch: http://www.twitch.tv/goodtimeswithscar* Instagram: http://instagram.com/goodtimeswithscar* Facebook: http://on.fb.me/1LCWlMV--------------------------------------------------------#HermitCraft8 #HermitCraftSeason8 #GoodTimesWithScar"
"z34MDuH2UDs","Dream Goes Shopping...","2021-06-20T23:15:27Z","UCZWBGXa6kiaWo9-pE8CX6Dg","Dream Shorts","22","21.24.06","[none]","1379434","130092","711","5011","https://i.ytimg.com/vi/z34MDuH2UDs/default.jpg","False","False","Dream Goes Shopping...#shortsSUBSCRIBE! Lots of uploads coming this year!Dream: @Dream BadBoyHalo: @BadBoyHalo This is what it is like when Dream goes shopping..."
"aONT7atzqfw","Floyd Mayweather vs Logan Paul: Fight goes the distance [Highlights, recap] | CBS Sports HQ","2021-06-07T05:40:56Z","UCja8sZ2T4ylIqjggA1Zuukg","CBS Sports HQ","17","21.24.06","CBS|CBS Sports|sports|cbs sports hq|sports hq|hq|logan paul|floyd mayweather|jake paul|floyd mayweather vs logan paul|mayweather vs paul|logan paul vs floyd mayweather|mayweather paul|showtime boxing|floyd mayweather jake paul|jake paul and floyd mayweather|logan paul floyd mayweather|paul brothers|logan paul boxing|jake paul takes floyds hat|jake paul boxing|conor mcgregor|logan paul youtube|jake paul vs floyd mayweather","16561579","144696","22880","26927","https://i.ytimg.com/vi/aONT7atzqfw/default.jpg","False","False","Watch the highlight from the Mayweather-Paul bout, plus get the full reaction from the Morning Kombat team on the action.Go to Showtime for all your extended coverage of Mayweather-Paul.More from Showtime Sports here: https://www.youtube.com/channel/UCFPoJNd0d4k1H9A6UOlikcgSUBSCRIBE TO OUR CHANNEL:https://www.youtube.com/user/CBSSportsHQ FOLLOW US ON:Facebook - https://www.facebook.com/CBSSports/Instagram - https://www.instagram.com/cbssportshq/Twitter - https://twitter.com/CBSSportsHQ"
"A4ff3Og3rfE","ASMR Street Food | Pub street food and cooking , dinner, drink , BBQ restaurant","2021-06-20T10:39:52Z","UCGbU7Lm7BFROEOUgrYPEhEg","MINIATURE COOKING TIME","22","21.24.06","real tiny kitchen|miniature cooking real food|foodie|chinese food|small kitchen equipment|mini food|Tiny Kitchen|Miniature|cooking|mini cooking|small food|small cooking|miniature food|cooking videos|cooking food recipe|diy mini food real|easy food recipe|mini food cooking|mini kitchen real food|Food|مصغرة طهي الطعام الصيني|ASMR Street Food | Pub street food and cooking|dinner|drink|BBQ restaurant","1019165","18629","1366","58","https://i.ytimg.com/vi/A4ff3Og3rfE/default.jpg","False","False","ASMR Street Food | Pub street food and cooking , dinner, drink , BBQ restaurant#shorts​ #Cooking​ #Food"
