video_id,title,publishedAt,channelId,channelTitle,categoryId,trending_date,tags,view_count,likes,dislikes,comment_count,thumbnail_link,comments_disabled,ratings_disabled,description
"W5jWmeCZzp4","Sha'Carri Richardson, now America's fastest woman, scorches her Olympic Trials final | NBC Sports","2021-06-20T04:59:19Z","UCqZQlzSHbVJrwrn5XvzrzcA","NBC Sports","17","21.24.06","Olympic Sports|Olympics|Sha'Carri Richardson|Sha'Carri Richardson runner|Sha'Carri Richardson 100m|Sha'Carri Richardson olympics|Sha'Carri Richardson 2021|Sha'Carri Richardson olympic trials|Track & Field|Athletics|100 meters|Flojo|Olympic Games|Tokyo 2020|Shakira Richardson|100 meter dash|Olympic Trials","6242522","135937","3489","21687","https://i.ytimg.com/vi/W5jWmeCZzp4/default.jpg","False","False","Race starts at 4:20. Watch the interview at the end.Sha'Carri Richardson wins the 100m final at the U.S. Olympic Trials in 10.86, qualifying for the Tokyo Games along with Javianne Oliver (10.99) and Teahna Daniels (11.03). #NBCSports #ShaCarriRichardson #TrackandField» Subscribe to NBC Sports: https://www.youtube.com/nbcsports?sub...» Watch Live Sports on NBCSports.com: http://www.nbcsports.com/liveNBC Sports Group serves sports fans 24/7 with premier live events, insightful studio shows, and compelling original programming. NBC Sports is an established leader in the sports media landscape with an unparalleled collection of sports properties that include the Olympics, NFL, Premier League, NHL, NASCAR, PGA TOUR, the Kentucky Derby, Tour de France, French Open, IndyCar and many more. Subscribe to our channel for the latest sporting news and highlights!NBC Olympics is responsible for producing, programming and promoting NBCUniversal's Olympic coverage. It is renowned for its unsurpassed Olympic heritage, award-winning production, and ability to aggregate the largest audiences in U.S. television history. Having produced every Summer Olympics since Seoul in 1988 and every Winter Olympics since Salt Lake City in 2002, the networks of NBCUniversal are synonymous with the Games in the United States. NBCUniversal has the U.S. media rights on all platforms to all Olympic Games through 2032. At the conclusion of the 2032 Games, NBCUniversal will have presented 23 total Olympic Games and 17 consecutive, the most for a U.S. media company in both categories.Visit NBC Sports: https://www.nbcsports.comFind NBC Sports on Facebook: https://www.facebook.com/NBCSportsFollow NBC Sports on Twitter: https://twitter.com/nbcsportsFollow NBC Sports on Instagram: https://www.instagram.com/nbcsports/Sha'Carri Richardson, now America's fastest woman, takes 100m final by storm at Olympic Trialshttps://www.youtube.com/nbcsports"
"d2rSfCPIv8c","*NEW* FORTNITE SUMMER EVENT! (LIVE EVENT & FREE REWARDS)","2021-06-22T12:08:18Z","UCGLcmUt6Y7YEWdiehVg9QBg","Pack A Puncher","20","21.24.06","Fortnite|Fortnite Season 7|Season 7 Fortnite|Fortnite Live|Fortnite Battle Royale|Fortnite Chapter 2 Season 7|fortnite update|fortnite gameplay|fortnite leaks|New Fortnite|Fortnite New|Fortnite Live Event|new skins fortnite|fortnite thanos|season 7 live event|thanos fortnite|fortnite leaked skins|fortnite map changes|fortnite coral castle|fortnite 17.10|fortnite 17.10 update|Pack A Puncher","215698","12197","383","71","https://i.ytimg.com/vi/d2rSfCPIv8c/default.jpg","False","False","💰 DONATE & BE ON STREAM: https://youtube.streamlabs.com/packapuncher 💸 BECOME A MEMBER: https://www.youtube.com/channel/UCGLcmUt6Y7YEWdiehVg9QBg/joinIn today's stream we will be checking out Fortnite Chapter 2 Season 7's first update 17.10! Drop a LIKE if you're hyped!Daily Twitch Streams: https://www.twitch.tv/packapuncherOn Twitch I stream everything Non-Fortnite: COD Zombies, Warzone, etc :)SPECIAL DONATIONS:$5.00 - Five Dollar Footlong $6.66 - Conspiracy Confirmed $7.77 - Lucky Nyan Cat $10.00 - Banana Party $17.38 - Trap Queen $20.00 - Super Dog $25.00 - John Cena $50.00 - NUKE! TAKE COVER $100.00 - HALLELUJAH $200.00 - STORM WARNING $500.00 - PACK A PUNCH HYPE!!!💎 Use my Creator Code PackAPuncher in the Fortnite Item Shop! Code PackAPuncher ▶️ Twitter: https://twitter.com/PackAPuncherYT▶️ Instagram: https://www.instagram.com/packapuncheryt/Join my Discord Server & come hang out with me: https://discord.gg/MQtcZmc 🎮 ALL Livestream Replays: https://www.youtube.com/playlist?list=PLV8yp9IHDmHkg7O6sZqscgJohijgSQGyw😁 ALL Vlogs: https://www.youtube.com/playlist?list=PLV8yp9IHDmHmnAk7eT0U3Np9sJlcrWYsDThanks for watching the live stream, I hope you enjoy :)"
"ZVdATkG8R5U","The Inside Crew Reacts to Ben Simmons'  Game 7 Performance Against the Atlanta Hawks | NBA on TNT","2021-06-21T03:44:06Z","UCU7iRrk3xfpUk0R6VdyC1Ow","NBA on TNT","17","21.24.06","NBA on TNT|NBA|Inside the NBA|Charles Barkley|Shaq|Kenny Smith|Ernie Johnson|Ben Simmons|Joel Embiid|Doc Rivers|Philadelphia 76ers|Atlanta Hawks|NBA Playoffs|ECF|Eastern Conference Finals|Game 7","1467822","18784","439","5273","https://i.ytimg.com/vi/ZVdATkG8R5U/default.jpg","False","False","After the Philadelphia 76ers were eliminated by the Atlanta Hawks in Game 7, the Inside guys break down Ben Simmons' performance and his future. Watch highlights from Inside the NBA with Shaq, Charles Barkley, Kenny Smith and Ernie Johnson and more! Subscribe now to be updated on the latest videos: https://www.youtube.com/nbaontnt?sub_confirmation=1Connect with NBA on TNT:Follow NBA on TNT on Twitter: https://twitter.com/NBAonTNTLike NBA on TNT on Facebook: https://www.facebook.com/NBAONTNT/Follow NBA on TNT on Instagram: https://www.instagram.com/nbaontnt/?hl=en"
"jIEOF-Aa1Rk","Dungeons and Dragons: Dark Alliance is truly, truly awful (Review)","2021-06-21T16:00:20Z","UCZ7AeeVbyslLM_8-nVy2B8Q","Skill Up","20","21.24.06","skill up|skill|up|gameplay|games|guide|dark alliance gameplay|dark alliance|dark alliance preview|dark alliance impressions|dark alliance review|dark alliance release date|dark alliance ps5|dark alliance pc|dark alliance xbox series x|dark alliance guide|dungeons and dragons dark alliance|Drizzt do 'urden gameplay|catti brie gameplay|bruenor battlehammer gameplay|wulfgar gameplay|Dungeons and Dragons Dark Alliance Review|trailer|release date|gamepass","436636","25969","765","4727","https://i.ytimg.com/vi/jIEOF-Aa1Rk/default.jpg","False","False","Get 12 months of Curiosity Stream for the price of like, 3 Starbucks coffees (or something, idk - I'm in Australia and we don't have Starbucks here. Well we do, but no one goes there except tourists and people who don't know what good coffee is supposed to taste like): https://curiositystream.com/skillup--Dungeons and Dragons: Dark Alliance is the worst game I've played this year and it's not even close. Review code provided by Koch Media--Edited by Austin @ausomehd--Skill Up Gaming Facebook Page!https://www.facebook.com/skillupgaming/Twitter: https://twitter.com/SkillUpYT?lang=en (@skillupyt)Instagram: https://www.instagram.com/skillupyt/?hl=enJoin us on the community Discord: https://discord.gg/Q728ewv--Recent vids:Ratchet and Clank Rift Apart review: https://youtu.be/EfkzYwkSLvoNecromunda: Hired Gun review:https://youtu.be/H7yvDV0k-M8Biomutant Review:https://youtu.be/JwMmTtgLMBIResident Evil Village review:https://youtu.be/dVxEv5hIlFUReturnal review:https://youtu.be/XeS3KI9vgu8Diablo II Resurrected Impressions: https://youtu.be/onOJDSRb_JQ"
"MrXqJ1yMt-w","Friday Night Funkin but EVERYONE SINGS IT... (Ugh, Guns, Animal, Nerves) FNF Mods #26","2021-06-21T14:45:01Z","UCgX22RsYC4itKYyYaCSAvZQ","SuperDog Tyler","20","21.24.06","funny moments|fnf funny moments|fnf|friday night funkin|blantados|everyone sings it|everyone sings|fnf but everyone sings|each turn|each turn a different cover is used|different|cover|sky|hex|character changing|each turn a different cover|different cover|mod|fnf mod|fnf mods|vs everyone|everyone|everyone mod|sings|funny|moments|friday|night|funkin|superdog tyler|friday night funkin week 7|ugh|everyone sings ugh|fnf ugh|week 7|fnf week 7|mods|BETADCIU","584977","12764","612","1640","https://i.ytimg.com/vi/MrXqJ1yMt-w/default.jpg","False","False","Today I play FRIDAY NIGHT FUNKIN Mods and play FNF but Every Turn a Different Cover is Used MOD! This mod was created by  @Blantados and I had a blast playing it! Join the SUPERSQUAD! ► https://bit.ly/2YXUTniThis Friday Night Funkin Fnf but Every Turn a Different Cover is Used is created by Blantados Check out Blantados here! ► https://www.youtube.com/channel/UC4rwJYVeDHxGKnFDhHz88ZQComment what you think down below! Want to see me play other games? Leave a suggestion! Subscribe to join the SUPERSQUAD! And don't forget to join the official group on Roblox!https://www.roblox.com/groups/4964923/SuperDog-Tylerhttps://www.roblox.com/users/1107778599/profileStay awesome SuperSquad!#Blantados #FNF​​ #Mods"
"reP1gVGpFKo","Ted Lasso — Season 2 Official Trailer | Apple TV+","2021-06-21T12:59:46Z","UC1Myj674wRVXB9I4c6Hm5zA","Apple TV","24","21.24.06","ted lasso|ted|lasso|ted lasso season 2|ted lasso season two|season 2|trailer|ted lasso trailer|ted lasso official trailer|official teaser|ted lasso apple tv|apple tv ted lasso|college football|professional soccer|soccer|football|jason sudeikis|kansas|coach lasso|coach ted lasso|nbc sports|bill lawrence|premier league|brendan hunt|hannah waddingham|bronson webb|apple|apple tv|apple tv+|apple tv plus|apple tv app|apple original|apple tv youtube","1549428","7155","261","0","https://i.ytimg.com/vi/reP1gVGpFKo/default.jpg","True","False","A new season of Ted Lasso returns July 23. It’s more exciting than Higgins at an open mic jazz club. Watch exclusively on Apple TV+ https://apple.co/_TedLasso Golden Globe® winner Jason Sudeikis is Ted Lasso, an American football coach hired to manage a British soccer team—despite having no experience. But what he lacks in knowledge, he makes up for with optimism, underdog determination...and biscuits. Song: “Under Pressure” by Queen and David Bowie https://apple.co/UnderPressure_QueenSubscribe to Apple TV’s YouTube channel: https://apple.co/AppleTVYouTubeFollow Ted on Twitter: https://twitter.com/TedLassoFollow Apple TV:Instagram: https://instagram.com/AppleTVFacebook: https://facebook.com/AppleTVTwitter: https://twitter.com/AppleTVGiphy: https://giphy.com/AppleTVMore from Apple TV: https://apple.co/32qgOEJApple TV+ is a streaming service with original stories from the most creative minds in TV and film. Watch now on the Apple TV app: https://apple.co/_AppleTVapp#TedLasso #Trailer #AppleTV"
"2a8eEnzjWjk","I Raced Across The Ocean","2021-06-20T16:25:27Z","UCVhZyGllAVd-Wl6kNufV0uA","JackManifoldTV","20","21.24.06","Jack manifold|tommyinnit|minecraft|mine craft|dream|dream minecraft|funny|1000% funnier|minecraft funny|funniest minecraft video|minecraft manhunt|minecraft speedrunner vs hunter|minecraft speedrunner|minecraft speedrun|minecraft challenge|challenge|minecraft but|tubbo|niki|nihachu|wilbur soot|wilbur|soothouse|rocketduo|in real life|boat|boat race|isle of wight|vlog|irl|tom simons|I Raced Across The Ocean","2594123","363114","1188","13765","https://i.ytimg.com/vi/2a8eEnzjWjk/default.jpg","False","False","Me & Nihachu raced Tubbo & Wilbur Soot across the ocean! This was CRAZY!!The rules are simple: we race in teams of two across the channel and to the Isle of Wight (France). Whoever loses has to throw something they care about into the ocean and lose it FOREVER!!Come watch Jack Manifold on the big screen (aka Twitch) - https://www.twitch.tv/JackManifoldTV Edited by: @Wheatskins   @Tubbo @Niki Nihachu @Wilbur Soot Follow my Twitter - @JackManifoldTV Follow my Instagram - @JackManifoldTV"
"vFJOffFE2i0","Guess That Emoji Challenge | Lexi Hensler vs Dom Brack","2021-06-21T16:00:10Z","UCDP7DZOgj8VTyhyVNup83QQ","Amp World","24","21.24.06","Amp World|Amp World News|Brent Rivera|Lexi Rivera|Ben Azelart|Dom Brack|Andrew Davila|Lexi Hensler|Stokes Twins|Jeremy Hutchins|Pierson Wodzynski|GUESS THAT EMOJI|GUESS THAT EMOJI CHALLENGE|GUESS THAT EMOJI MOVIE|GUESS THAT EMOJI SHOW|GUESS THAT EMOJI BRENT RIVERA VS LEXI RIVERA|GUESS THAT EMOJI WIN 1000$|GUESS THOSE EMOJI|FUNNY|FUNNY CHALLENGE|FUNNY CHALLENGE VIDEO|FUNNY EMOJI GAME|brent rivera|ben azelart","825737","58689","449","2903","https://i.ytimg.com/vi/vFJOffFE2i0/default.jpg","False","False","Find us on IG and TikTok! @Amp World Follow The FAM!Brent Rivera - @Brent RIveraBen Azelart -  @Ben Azelart  Lexi Hensler - @Lexi Hensler  Stokes Twins - @Stokes Twins  Lexi Rivera  - @Alexa Rivera Jeremy Hutchins - @Jeremy Hutchins  Andrew Davila - @Andrew Davila  Dom Brack -  @Dominic Brack  Pierson Wodzyinski - @pierson #AmpWorld"
"9wNUpVhTfYA","El Mayor Clasico - Apuesta A Mi 🎬 (Video Oficial)","2021-06-21T17:00:09Z","UCej_85un1d_8u4XnK-QSSsg","El Mayor Clasico","10","21.24.06","el mayor clasico|versace|el mayor ft natti natasha|el mayor clasico el gagayor|el mayor clasico ft natti natasha|el mayor clasico vibrando|lamacula|clasico|dembow|dominicano|urbano|elpapadeldembow|apuesta a mi|el mayor jay elite|dembow 2021|alofoke el mayor|musica urbana|alofoke el mayor clasico","512203","61824","681","6736","https://i.ytimg.com/vi/9wNUpVhTfYA/default.jpg","False","False","Canción: Apuesta A MiArtista: El Mayor ClasicoSello Discográfico: Clasico House IncSuscríbete a mi canal ➡️  https://smarturl.it/h2bc6t🎵 Stream/Download: Apple Music: SoonSpotify: SoonAmazon: SoonAudiomack: SoonTidal: SooniTunes: SoonRedes SocialesFacebook: https://smarturl.it/m3a7ojInstagram: https://smarturl.it/x3694qLyrics:Arcangel dijo en una entrevista que si el dinero no cambia a las personas, simplemente no estás haciendo dinero... ¿Y saben que? Es verdad.La cortina de mi casa la hice en tela de dinero En mi WhatsApp na’ ma’ hay número’ de actore’ y pelotero’Me doy los gu’to’ que yo quiero, no se cuentan lo’ cuero’Na’ ma’ me faltan do’ paise’ pa’ viaja e’te mundo enteroGastando con hoja e’ palo de 2mil y pico pacaNo se cuenta la paca, eso e’ gata, gata y gataNo e’ cualquier arraca vaca que puede frontea’me e’ pacaEn mi coro cualquier guaremate tiene una AKMe voy pa’ una villa por do’ semana a depejameUna gata pa’ que mame4 puro pa’ fumameLo tiguere pa’ curameA mi banda e’ que hay que da’meYa yo hice mi imperio, a mi hay que mata’me pa quita’meAhora tripeo en un jetEn la villa te escuchéPasandola de cachéTu mujer me dice YESA tu gente le piché pero la barriga con una uziVengan a buca’me, ’toy en mi casa en un jacuzziAnte’ nadie me bu’caba, era un diamante sin pulirAhora la ropa ha’ta la boto, no la vuelvo a repetir’tamo demasiado alto, tu no le llega’ al perfil’tan copiandome la forma de cantar y de vestirDe prenda’ ya ’toy podri’o, ’tamo rulin pana míoDando vuelta’ por Miami viendo a lo’ modelo’ mioEn las islas hawaiana’ me compré un bohioPuse una cubana y do’ italiana’ pa’ que me hicieran un trioEn e’ta yo bajé ruso, tu sabe’, uno va de abusoNo me hable’ de gente que hace tiempo que uno se la pusoPlomo pal’ intruso, pero si te cuento inclusoVienen por debajo ’el agua y le damo’ plomo a to’ eso’ buso’Soy una’ de la’ garganta’ má’ cara del movimientoCuando digo que cobro 500 socio no te mientoLo’ cheque’ siguen llegando de 300 y 400Mientra’ ustede’ hablando mierda yo meciendome en mi asientoMi problema no e’ monetario, hace rato que ya somo’ millonarioMillonario soy, esa e’ mi realidadMi seguridad es seguridad de tu seguridadMi problema no e’ monetario, hace rato que ya somo’ millonarioMillonario soy, esa e’ mi realidadMi seguridad es seguridad de tu seguridad¿Te quillo porque la aplico o te quillo porque soy rico?Mira 10 año’ pa’ tra’ y yo lo que vendía abanico’Nadie me frontee, que cualto yo he vi’to por pilaNo hay una maldita movie que me falte por vivirla E’ verdad que mis amigos los cuento con una manoNo te llevo en mi corazón por rata y por gusanoTengo más seguridad que el presidente de CoreaCon más inteligencia que la CIA y que la DEAEl francotirador lo tengo encima ’e la azoteaTo’ el que forza pa’ e’te la’o la vaina se le pone feaTu no me ’ta haciendo daño, tu te hace’ daño tu mi’moPorque no tienes talento y ’ta aburriendo con lo mi’moYo ’toy poderoso, mi cerebro ’ta ambiciosoTu rapeo e’ de restaurante, tu rapeo parece’ un boteYo me he pue’to to’ lo’ Jordan, me he pue’to to’ lo Louis VuittonYa yo puedo anda’ encuero y como quiera me veo cabrónCon este rap se puede hacer 7 producciones de dembow cojan ahí El papa, de lo papá de abuelo que no han nacido.#ElMayorClasico​ #ApuestaAMi©℗ Clasico House IncYoutube Channel powered by Republic Network. All Rights Reserved."
"Ig68jvGqJkY","10 dead after 18-car crash on Alabama highway","2021-06-21T01:09:11Z","UCBi2mrWuNuyYy4gbM6fU18Q","ABC News","25","21.24.06","18|Claudette|Storm|Tropical|abc|alabama|crash|deadly|highway|investigators|news|ntsb|p_cmsid=2494279|p_vid=news-78391042|roads|slick|vehicles|weather|wnt","1274846","12429","814","5639","https://i.ytimg.com/vi/Ig68jvGqJkY/default.jpg","False","False","The NTSB has sent investigators to the scene, which may have been caused by slick roads after Tropical Storm Claudette battered the area.WATCH THE FULL EPISODE OF 'WORLD NEWS TONIGHT':https://bit.ly/3uHCDO5 WATCH OTHER FULL EPISODES OF WORLD NEWS TONIGHT:http://abc.go.com/shows/world-news-tonightWATCH WORLD NEWS TONIGHT ON HULU:https://bit.ly/3iQLwPp#ntsb #crash #alabama"
"UfHDATZzrao","Hermitcraft SEASON 8 Day 1 RECAP!","2021-06-21T15:15:03Z","UC32w6uX5qtmUtF4QQQ2PKaQ","Hermitcraft Recap - a show by fans for fans","20","21.24.06","hermitcraft|hermitcraft recap|hermitcraft season 7|hermitcraft season VII|hermitcraft 7|hermit minecraft|what is hermitcraft|what happened on hermitcraft|minecraft|minecraft let's play|minecraft smp|hermitcraft smp|minecraft survival|minecraft multiplayer|minecraft youtube|mcyt|mcyt fandom|minecon|who to watch minecraft|LP|hermitcraft memes|Hermitcraft season 8|hermitcraft season 8 episode 1|day 1 recap","344239","27495","109","1012","https://i.ytimg.com/vi/UfHDATZzrao/default.jpg","False","False","Let's go through all the first videos uploaded on Hermitcraft season 8New Hermits:PearlescentMoon: https://youtu.be/HIVv5TLrf8gGeminiTay: https://youtu.be/6uY4CNKNHQ4Server seed:  -7381235180058670651CHAPTERS:0:00 - intro2:16 - the whole thing14:32 - you missed the whole thing!JOIN OUR DISCORD SERVER! https://discord.gg/GpNhcD5 → r/hermitcraft Discord: https://discord.gg/tnWwuVH → Website http://www.hermitcraft.com → Twitter https://twitter.com/hermitcraft_ → Reddit http://www.reddit.com/r/HermitCraft → Twitch Channel http://www.twitch.tv/hermitcraft_/ Background music: http://www.bensound.com/"
"bej9ECbaKuw","Sodium metal is soft and squishy","2021-06-19T16:00:15Z","UCA0mlN90EHCizvo101nbr-g","NileRed Shorts","28","21.24.06","nilered|nile|red|science|chemistry|sodium|metal|element|alkali|cutting|soft|shiny|squishy","5448231","272130","3608","3438","https://i.ytimg.com/vi/bej9ECbaKuw/default.jpg","False","False","Check out my main channel: https://www.youtube.com/c/NileRedSodium metal is stored under oil because it's reactive to moisture and air. Most metals are hard, but sodium metal is really soft, and you can squish it, just with your fingers, if you squeeze really hard. Metals are usually shiny, and sodium metal is as well, but because it's so reactive, it quickly tarnishes. But because it's so soft, it can be easily cut with a knife, and on the inside, we can see the nice and shiny metal.-------------------------------------------Nile talks about lab safety:  https://youtu.be/ftACSEJ6DZA​#shorts"
"VHg_UAfUgjA","Snake Eyes NEW Trailer | Behind The Mask (2021 Movie) | Henry Golding, G.I. Joe","2021-06-21T13:01:57Z","UCF9imwPMSGz4Vq1NiTWCC7g","Paramount Pictures","1","21.24.06","Snake Eyes|Snake Eyes Movie|Snake Eyes: G.I. Joe Origins|G.I. Joe|Henry Golding|Andrew Koji|Ursula Corbero|Samara Weaving|Larry Hama|SkyDance|Paramount Pictures|Paramount Pics|Lorenzo Di Bonaventura|Action (Movie Genre)|Action Movie|New Movie|Coming Soon|Trailer|New Trailer|Snake Eyes Trailer|2021 Movie","3571348","7323","311","1006","https://i.ytimg.com/vi/VHg_UAfUgjA/default.jpg","False","False","Discover what hides behind the mask. Watch the 💥action-packed💥 NEW trailer for #SnakeEyes. Experience the movie on the big screen - Only in theatres July 23.Snake Eyes: G.I. Joe Origins stars Henry Golding as Snake Eyes, a tenacious loner who is welcomed into an ancient Japanese clan called the Arashikage after saving the life of their heir apparent. Upon arrival in Japan, the Arashikage teach Snake Eyes the ways of the ninja warrior while also providing something he’s been longing for: a home. But, when secrets from his past are revealed, Snake Eyes’ honor and allegiance will be tested – even if that means losing the trust of those closest to him. Based on the iconic G.I. Joe character, Snake Eyes: G.I. Joe Origins also stars Andrew Koji as Storm Shadow, Úrsula Corberó as Baroness, Samara Weaving as Scarlett, Haruka Abe as Akiko, Tahehiro Hira as Kenta and Iko Uwais as Hard Master.#SnakeEyeshttps://www.instagram.com/SnakeEyesMovie/https://www.facebook.com/SnakeEyesMovie/https://twitter.com/SnakeEyesMovie/Paramount Pictures Corporation (PPC), a major global producer and distributor of filmed entertainment, is a unit of Viacom (NASDAQ: VIAB, VIA), home to premier global media brands that create compelling television programs, motion pictures, short-form content, apps, games, consumer products, social media experiences, and other entertainment content for audiences in more than 180 countries. Connect with Paramount Pictures Online: Official Site: http://www.paramount.com/Facebook: https://www.facebook.com/ParamountInstagram: http://www.instagram.com/ParamountPicsTwitter: https://twitter.com/paramountpicsYouTube: https://www.youtube.com/user/ParamountTikTok: https://www.tiktok.com/@paramountpics"
"CS8-hNwrVHQ","Logic - Live from the Country","2021-06-21T17:49:08Z","UCoDcFZ5KZ0KwBC_omalJuiA","BobbysWorld","10","21.24.06","[none]","147018","17408","114","1150","https://i.ytimg.com/vi/CS8-hNwrVHQ/default.jpg","False","False","Logic - Live from the CountryLogic & Friends Create a Song & Video Live in the StudioShot & Edited by Justin FleischerAdditional angles from JT Clemente & Kyle Metcalfehttps://twitter.com/Logic301​https://www.instagram.com/logic/​https://www.twitch.tv/logic​"
"8DAwcPm0L2g","Moving On","2021-06-20T23:05:25Z","UCOYSYNsxTfGTGbMu2c-kpfg","Mopi","24","21.24.06","mopi","519773","70101","1500","8289","https://i.ytimg.com/vi/8DAwcPm0L2g/default.jpg","False","False","Moving on… love ya guysHave a great Father's Day and see ya again soon:)My other socials:●Twitter: https://twitter.com/Mopi● Insta: https://www.instagram.com/commonmopi/...Outro song:https://soundcloud.com/trenton-taft/yungtrench-please-prod-shxrkz-x-joeldemora"
"_uhomU0j7WA","AFRICAN HOME: WANTED","2021-06-21T16:00:15Z","UCUocOQtoaHPuT0K8lME559A","SamSpedy","23","21.24.06","samspedy|samspedy comedy|mama ojo and ojo|ojo comedy|african parents|african home|nigerian movies|nigerian parents|funny nigerian movies|ojo and mom|wanted|$1million|samspedywanted|samspedy wanted video|samspedy 2021","753381","36533","473","2892","https://i.ytimg.com/vi/_uhomU0j7WA/default.jpg","False","False","In This Episode, A Friend Of Mama Ojo (Sandra Olive) Was Declared Wanted For Stealing $10 Million From Her Husband. She Then Came Over To Hide At Mama Ojo's House, But They Must Find A Way To Keep Ojo's Mouth Shut. Find Out What Happened!SECOND CHANNEL - https://www.youtube.com/channel/UCEuMxZxgHqrVXzwd5julx8QFollow me on Instagram: https://www.instagram.com/samspedy/Song Store LinksiTunes: http://itunes.apple.com/album/id1530382366?ls=1&app=itunesApple Music: http://itunes.apple.com/album/id/1530382366Spotify: https://open.spotify.com/album/0nJNPynLV5OCZ0ZIREVc8OThanks For Watching!Thumbs Up, Share And Subscribe!#samspedy #wanted #$1million"
