video_id,title,publishedAt,channelId,channelTitle,categoryId,trending_date,tags,view_count,likes,dislikes,comment_count,thumbnail_link,comments_disabled,ratings_disabled,description
"FXcLiqIKdmw","Minecraft Random Item Challenge VS 2 Hunters","2021-06-23T19:30:13Z","UCTkXRDQl0luXxVQrRQvWS6w","Dream","20","21.24.06","Dream Minecraft|dream Minecraft youtube|minecraft|dream|Minecraft Random Item Challenge|random items|items are duplicated every minute|minecraft duplication|minecraft item randomizer|Speedrunner vs someone trying to stop them|Beating Minecraft but my friend tries to stop me|Minecraft but water rises every minute|minecraft but challenge|minecraft challenge|challenge|minecraft 1.14|beating minecraft|2 hunters|vs 2 hunters","7033774","819913","11617","52596","https://i.ytimg.com/vi/FXcLiqIKdmw/default.jpg","False","False","Minecraft Random Item Challenge VS 2 Hunters... This was absolutely insane.Patreon (Plugin): https://www.patreon.com/DreamWasTakenFollow my socials:➽ Twitter - @dream➽ Instagram - @dreamwastaken➽ Text Me - 407-214-5333Merch: https://www.dreams.isGeorge:  @GeorgeNotFound Sapnap:  @Sapnap We haven't decided on a name for this, but if this video gets 2 million likes we will consider doing a rematch! This video is a different rendition of our normal challenges, where there are two hunters trying to kill me while we have random items.We can break blocks, but they don't drop items. There is a 1000x1000 border. Every two minutes we each get a completely random item. We can't pick up each others items.This is a new Minecraft but, 1.16 challenge that we have decided to try. I try to survive, while my friend George AND my friend Sapnap tries to prevent me from doing it. It's a battle, and it's super intense and we had a lot of laughs. I love doing these challenges.Not Minecraft, But Water Rises or Minecraft, But Lava Rises, or any other but challenge like that. This is a speed run / speed runner of Minecraft against a killer / assassin#MinecraftRandomItemChallenge"
"ETh_n0u-g5o","BROWN SUGAR SALMON","2021-06-23T15:54:57Z","UCsQBsZJltmLzlsJNG7HevBg","Tyler, The Creator","2","21.24.06","tyler the creator|call me if you get lost|lumberjack|wusyaname","1995451","290858","1354","17802","https://i.ytimg.com/vi/ETh_n0u-g5o/default.jpg","False","False","DIRECTOR: WOLF HALEYDP: LUIS PANCH PEREZPRODUCER: TARA RAZAVI FOR HAPPY PLACE'LUMBERJACK' IS AVAILABLE NOW: https://tylerthecreator.lnk.to/LUMBERJACK"
"23BcmJwUcrY","Joyner Lucas - Legend ft. Rick Ross (Official Video)","2021-06-23T16:00:03Z","UCUebubwSuTHfHjWJI4gCS9A","Joyner Lucas","10","21.24.06","Rick Ross|T.I|Snoop Dogg|Chris Brown|Diddy|Legend|Joyner Lucas|Izo|Dhruv Joshi|Tully|Evolution|Rap|Hip hop|legends|joyner lucas legend|rick ross legend|joyner lucas rick ross legend|LEGEND RICK ROSS|legend joyner lucas|joyner lucas evolution|joyner lucas rick ross|legend rick ross|joyner lucas reaction|joyner lucas fall slowly reaction|joyner lucas type beat|rap|JOYNER LUCAS EVOLUTION|evolution|new","587201","64437","377","5795","https://i.ytimg.com/vi/23BcmJwUcrY/default.jpg","False","False","Stream Joyner Lucas now: https://orcd.co/joynerlucasevolutionEvolution Merch: https://bit.ly/2EJbZ30Written and Managed on Tully: https://www.tullyconnect.com#JoynerLucas #Legend #RickRoss #Evolution"
"NJea386275c","WUSYANAME","2021-06-22T16:00:27Z","UCsQBsZJltmLzlsJNG7HevBg","Tyler, The Creator","2","21.24.06","tyler the creator|call me if you get lost|lumberjack","3195766","379041","1915","22095","https://i.ytimg.com/vi/NJea386275c/default.jpg","False","False","DIRECTOR: WOLF HALEYDP: LUIS PANCH PEREZPRODUCER: TARA RAZAVI FOR HAPPY PLACE'LUMBERJACK' IS AVAILABLE NOW: https://tylerthecreator.lnk.to/LUMBERJACK"
"sDmeXdC3myg","Jordan Schlansky’s Final CONAN Appearance - CONAN on TBS","2021-06-23T03:00:23Z","UCi7GJNg51C3jgmYTUwqoUXA","Team Coco","23","21.24.06","Conan O'Brien|Conan|Conan (TV Series)|TBS (TV Channel)|Team Coco","989623","38091","433","3319","https://i.ytimg.com/vi/sDmeXdC3myg/default.jpg","False","False","Conan won’t leave the Largo until he gets an answer to the question that has bedeviled him for years: what the f*ck does Jordan do? More CONAN @ http://teamcoco.com/videoTeam Coco is the official YouTube channel of late night host Conan O'Brien, CONAN on TBS & TeamCoco.com. Subscribe now to be updated on the latest videos: http://bit.ly/W5wt5DFor Full Episodes of CONAN on TBS, visit http://teamcoco.com/videoGet Social With Team Coco:On Facebook: ‪https://www.facebook.com/TeamCoco‬On Google+: https://plus.google.com/+TeamCoco/On Twitter: http://twitter.com/TeamCocoOn Tumblr: http://teamcoco.tumblr.comOn YouTube: http://youtube.com/teamcocoFollow Conan O'Brien on Twitter: http://twitter.com/ConanOBrien"
"IJO5m6EFL6A","Sexy Beasts | Official Trailer | Netflix","2021-06-23T12:00:00Z","UCGie8GMlUo3kBKIopdvumVQ","Netflix UK & Ireland","24","21.24.06","Addictive|Blind date|Blind dating|Competition|Dating|Finding Love|First Meeting|Funny|Goofy|Humorous|Looking for Love|Make-up|Prosthetics|Romantic|TV Reality|Talky","364680","2713","3133","1098","https://i.ytimg.com/vi/IJO5m6EFL6A/default.jpg","False","False","Hoping to say goodbye to superficial dating, real-life singles sport elaborate makeup and prosthetics to put true blind-date chemistry to the test.➡️SUBSCRIBE FOR MORE: http://bit.ly/29kBByrAbout Netflix:Netflix is the world's leading streaming entertainment service with 208 million paid memberships in over 190 countries enjoying TV series, documentaries and feature films across a wide variety of genres and languages. Members can watch as much as they want, anytime, anywhere, on any internet-connected screen. Members can play, pause and resume watching, all without commercials or commitments.Find Netflix UK on:➡️TWITTER: http://bit.ly/29lYvcs➡️INSTAGRAM: http://bit.ly/29slD8O➡️FACEBOOK: http://bit.ly/29mx00aOr visit the Netflix WEBSITE: http://nflx.it/29BcWb5Sexy Beasts | Official Trailer | Netflixhttps://youtube.com/NetflixUK"
"tEZRDlMVjg0","I Found the RAREST Axolotl in Minecraft Hardcore (#46)","2021-06-23T15:33:00Z","UCRlEFn0L2G_DktbyvN0AZ5A","WadZee","20","21.24.06","WadZee|I Found the Rarest Axolotl in Minecraft Hardcore|I Found the Blue Axolotl in Minecraft|Finding the blue axolotl in Minecraft|Minecraft Blue Axolotl|Minecraft Purple Axolotl|How to find the blue axolotl|Minecraft Axolotl Farm|finding the rarest mob in minecraft|I made an axolotl farm in minecraft|WadZee Minecraft|Minecraft Caves and Cliffs|Minecraft 1.17 Update|Minecraft Axolotls|WadZee Hardcore|WadZee Blue Axolotl|WadZee Purple Axolotl","1513206","121044","820","11287","https://i.ytimg.com/vi/tEZRDlMVjg0/default.jpg","False","False","I Found the RARE Blue Axolotl in Minecraft Hardcore, this is the RAREST Axolotl in Minecraft! In the NEW Minecraft 1.17 Caves and Cliffs Update they introduced Axolotls into the game, a new mob which comes in multiple different colours. In this video I show you have to find the BLUE Axolotl in Minecraft. Also, I made an Axolotl Farm in Minecraft Hardcore. ENJOYWatch the series from episode 1:https://www.youtube.com/watch?v=U7z9MJwIFnY&list=PLXYjxAo4KISJqoE1rkt3OXmM5rCrstpoVIF YOU ENJOYED THIS VIDEO, CHECK OUT THESE AS WELL:▸I Played the NEW Minecraft 1.17 Update! (#45)https://www.youtube.com/watch?v=p2Xp3BaUH4U&t=653s▸I Built a DRAGON in Minecraft Hardcore (#44)https://www.youtube.com/watch?v=bUAZvN_ROeA&t=7s▬▬▬▬▬▬▬▬▬▬▬▬▬ ★ FOLLOW ME ★▸  Second Channel: https://youtube.com/c/Wad2ee▸  Twitch: https://twitch.tv/wadzee​​▸  Twitter: https://twitter.com/WadZeeYT​​▸  Instagram: https://www.instagram.com/wadzeeyt/​​▸  TikTok: @wadzee▸ Discord: https://discord.gg/GKRWCV8KvZ​​▸ Email for business enquiries:📧 - wadzeeyt@gmail.com▬▬▬▬▬▬▬▬▬▬▬▬▬ ♫All music by Kevin Macleod is licensed under a Creative Commons Attribution 4.0 licence. https://creativecommons.org/licenses/​​...Source: http://incompetech.com/music/royalty-​​...Artist: http://incompetech.com/...Subscribe for more WadZee Hardcore Minecraft Lets Play Videos :)"
"TPBH3XO8YEU","Candyman - Official Trailer 2","2021-06-23T14:59:38Z","UCq0OueAsdxH6b8nyAspwViw","Universal Pictures","24","21.24.06","[none]","958758","9415","363","1380","https://i.ytimg.com/vi/TPBH3XO8YEU/default.jpg","False","False","CandymanIn Theaters August 27https://www.CandymanMovie.comDon’t say his name. Oscar® winner Jordan Peele unleashes a fresh take on the blood-chilling urban legend that your friend’s older sibling probably told you about at a sleepover: Candyman. Rising filmmaker Nia DaCosta (Little Woods) directs this contemporary incarnation of the cult classic.  For as long as residents can remember, the housing projects of Chicago’s Cabrini Green neighborhood were terrorized by a word-of-mouth ghost story about a supernatural killer with a hook for a hand, easily summoned by those daring to repeat his name five times into a mirror. In present day, a decade after the last of the Cabrini towers were torn down, visual artist Anthony McCoy (Yahya Abdul-Mateen II; HBO’s Watchmen, Us) and his girlfriend, gallery director Brianna Cartwright (Teyonah Parris; If Beale Street Could Talk, The Photograph), move into a luxury loft condo in Cabrini, now gentrified beyond recognition and inhabited by upwardly mobile millennials.With Anthony’s painting career on the brink of stalling, a chance encounter with a Cabrini Green old-timer (Colman Domingo; HBO’s Euphoria, Assassination Nation) exposes Anthony to the tragically horrific nature of the true story behind Candyman. Anxious to maintain his status in the Chicago art world, Anthony begins to explore these macabre details in his studio as fresh grist for paintings, unknowingly opening a door to a complex past that unravels his own sanity and unleashes a terrifying wave of violence that puts him on a collision course with destiny.Universal Pictures presents, from Metro Goldwyn Mayer Pictures and Jordan Peele and Win Rosenfeld’s Monkeypaw Productions, in association with BRON Creative, Candyman. Candyman is directed by DaCosta, and is produced by Ian Cooper (Us), Rosenfeld and Peele. The screenplay is by Peele & Rosenfeld and DaCosta. The film is based on the 1992 film Candyman, written by Bernard Rose, and the short story “The Forbidden” by Clive Barker. The film’s executive producers are David Kern, Aaron L. Gilbert and Jason Cloth."
"v0v2JGxJ56E","#4 CLIPPERS at #2 SUNS | FULL GAME HIGHLIGHTS | June 22, 2021","2021-06-23T04:08:14Z","UCWJ2lWNubArHWmf3FIHbfcQ","NBA","17","21.24.06","Basketball|G League|NBA|game-0042000312","2139943","22256","936","6155","https://i.ytimg.com/vi/v0v2JGxJ56E/default.jpg","False","False","#4 CLIPPERS at #2 SUNS | FULL GAME HIGHLIGHTS | June 22, 2021Jae Crowder inbounded the ball to Deandre Ayton for the dunk with 0.7 seconds remaining in regulation to lift the Phoenix Suns over the LA Clippers, 104-103, in Game 2. Deandre Ayton recorded a playoff career-high 24 PTS, along with 14 REB for the Suns, while Cameron Payne added a playoff career-high 29 PTS, along with 9 AST in the victory. Paul George tallied 26 PTS, 6 REB and 6 AST for the Clippers. The Suns lead this best-of-seven series, 2-0.Next Game:Phoenix Suns at LA Clippers - June 24 at 9pm/et on ESPN0:00 - 1Q2:16 - 2Q3:43 - 3Q5:37 - 4QSubscribe to the NBA: https://on.nba.com/2JX5gSNFull Game Highlights Playlist: https://on.nba.com/2rjGMgeFor news, stories, highlights and more, go to our official website at https://app.link.nba.com/e/NBA_siteGet NBA LEAGUE PASS: https://nba.app.link/nbaleaguepass5"
"84swXWscy6w","Hid Underwater To Cheat In Hide N Seek! *New House*","2021-06-23T14:21:35Z","UCkrKW1_u0O8qSc3xsLoRHew","Funk Bros","24","21.24.06","hide and seek|hide|seek|hide & seek|funk bros|funk|corey funk|capron funk|underwater|cheat|cheating in hide in seek|hid|pool|cheating|funk bros hide and seek|parea house|drew dirksen|britthertz|fortnite hide and seek","326314","12658","246","350","https://i.ytimg.com/vi/84swXWscy6w/default.jpg","False","False","Hid Underwater in a pool @Parea to cheat in hide n seek!Text Us! (1-951-524-7847) @Capron Funk @Corey Funk Funk Brand: https://funkbrand.co/MANAGEMENT: s.jacobs@bep-la.com"
"xoeln85pTEQ","the new iCarly is utterly bizzare...","2021-06-23T12:23:51Z","UCY6Ij8zOds0WJEeqCLOnqOQ","Alex Meyers","24","21.24.06","alex meyers|alex myers|alex mayers|icarly|icarly 2021","718878","51572","578","3901","https://i.ytimg.com/vi/xoeln85pTEQ/default.jpg","False","False","Go to https://www.dashlane.com/alexmeyers to download Dashlane FREE FOR LIFE on your first device, and if you like it use promo code: alexmeyers to get 25% off of Dashlane Premium when you sign up to use it on ALL your devicesNow you can watch my videos in Spanish!: https://bit.ly/Suscribirse_AlexMeyers_ESwatch my original iCarly video:https://youtu.be/kvnKIE3OmLY★☆★ Help Me Get to 3,000,000 Subscribers! http://bit.ly/1IqsdaqDownload my game!https://apps.apple.com/us/app/id1527894025https://play.google.com/store/apps/details?id=games.b6.alexCheck out my Podcasthttps://www.youtube.com/channel/UCBgm0clEVtGjgUKGHbMrqIw/★☆★Buy some Merch:  alexmeyers.teemill.com★☆★PLEASE SHARE THIS VIDEO!!★☆★PREVIOUS VIDEOS:Thank you so much for 2,000,000 subscribers.  If you like what you see, please share these videos with your friends to show support!"
"ST5v7-C3iDk","Character Teaser - Kaedehara Kazuha: Moonlit Breeze | Genshin Impact","2021-06-23T04:00:05Z","UCiS882YPwZt1NfaM0gR0D9Q","Genshin Impact","20","21.24.06","Amber|amber vtuber|genshi|genshi game|genshi impact|genshi video|genshin|genshin game|genshin impact|genshin impact 2020|genshin impact game|genshin impact good|genshin impact graphics|genshin impact introduction|genshin impact manga|genshin impact wiki|geshin|geshin game|Teyvat|yuanshen game|miHoYo China|miHoYo Japan|adventure story|open world game|anime style|MMORPG|anime games|mobile game|MMO PlayStation|yt:cc=on","2149308","270204","788","22704","https://i.ytimg.com/vi/ST5v7-C3iDk/default.jpg","False","False","The journey following his escape from Inazuma will be long and fraught with peril, something Kaedehara Kazuha is well aware of.The moon floats in the sky, and a gentle breeze blows by. Though a storm is coming, the ronin shall brave it with song and wine.Download FREE: https://genshin.mihoyo.com/en#GenshinImpact #miHoYo↓ Follow us for the latest news ↓Official Website: https://genshin.mihoyo.com/enOfficial Community: https://www.hoyolab.com/genshin/Facebook: https://www.facebook.com/GenshinImpact/Twitter: https://twitter.com/GenshinImpactInstagram: https://www.instagram.com/genshinimpact/Reddit: https://www.reddit.com/r/Genshin_Impact/"
"q1CrYYF58RA","Game Theory: The Disturbing Lore Of Lily's Garden","2021-06-22T19:05:24Z","UCo_IB5145EVNcf8hw1Kku7w","The Game Theorists","20","21.24.06","lily's garden|lily's garden ad|lily's garden ads|lily's garden gameplay|lily's garden game|lily's garden lore|lily's garden meme|lily's garden ad washing machine|lily's garden ads reaction|mobile game|mobile games|mobile game theory|game theory mobile games|weird games|weird game ads|game theorists|game theory|matpat|game theory lily's garden|lily's garden day|lily's garden android","2210944","155753","2040","14522","https://i.ytimg.com/vi/q1CrYYF58RA/default.jpg","False","False","Get yourself some BRAND NEW Food Theory Merch! ► https://bit.ly/3vu8MJsWant more WEIRD lore? ► https://youtu.be/ARoP4GNgKVgWe've talked about how mobile games are weird in a previous episode. Well, this is a game that proves it. Welcome to the disturbing world of Lily's Garden! A place where our titular heroine is up to more than just tending to some plants. This game is DARK! Which means, of course, that I needed to cover it. It is time to untangle the mystery of Lily's Garden. Find the game here ► https://play.google.com/store/apps/details?id=dk.tactile.lilysgardenThe Confusing Universe ► https://www.youtube.com/channel/UC8VJcUJNtyBpgtFpf5-k1JwSUBSCRIBE to Catch all the Theories! ► https://goo.gl/kQWHkJ        Need Royalty Free Music for your Content? Try Epidemic Sound. Get A 30 Day Free Trial! ► http://share.epidemicsound.com/MatPat#LilysGarden #MobileGame #WeirdGame #Lore #Scary #Theory #MatPat #Theory #GameTheory More THEORIES: FNAF, The FINAL Timeline ►► https://bit.ly/2MlHYFeFNAF, The Monster We MISSED! ►► https://youtu.be/_ygN8HLCaJgFNAF This Theory Changes Everything ► https://bit.ly/2JUQUn6FNAF, You Were Meant To Lose ► https://youtu.be/7bn8hM9k0b0FNAF 6, No More Secrets ► https://bit.ly/2LVCq4u   Credits:Writer: Matthew Patrick and Tom RobinsonEditors: Tyler Mascola and Pedro FreitasAssistant Editor: AlyssaBeCrazySound Editor: Yosi Berman"
"Yl3A6faQLyQ","LOKI Episode 3 Breakdown & Ending Explained Spoiler Review | Marvel Easter Eggs & Things You Missed","2021-06-23T10:21:37Z","UCq3hT5JPPKy87JGbDls_5BQ","Heavy Spoilers","24","21.24.06","loki|loki episode 3|loki episode 3 breakdown|reaction|ending explained|loki easter eggs|loki things you missed|loki disney plus|loki trailers|loki theories|loki prediction|loki fan theory|loki review|loki spoilers|loki leaks|vision|agatha harkness|loki leak|loki reaction|marvel|tva|the timekeepers|tva explained|mobius m mobius|lady loki|old loki|trailer|promo|episode 4 breakdown|theory|things you missed|mcu|spoilers|agatha|agatha harkness cameo","384488","18565","490","2637","https://i.ytimg.com/vi/Yl3A6faQLyQ/default.jpg","False","False","LOKI Episode 3 Breakdown & Ending Explained Spoiler Review | Marvel Easter Eggs & Things You Missed. We review, recap and explain the third episode of Loki on Disney Plus. This contains easter eggs, theories, spoilers and a breakdown of the events and behind-the-scenes leaks on the Marvel property. We also discuss the TVA, Mobius M. Mobius and why Kang could be behind it all.#Loki #EasterEggs #EndingExplained #Mobius #Marvel #MCU #Thor #Episode3 #Trailer #PostCreditsScene #TVA #Kang #LadyLokiIf you enjoyed this video then please subscribe to the channel https://www.youtube.com/channel/UCq3hT5JPPKy87JGbDls_5BQ?sub_confirmation=1If You Want To Help Support The Channel So I Can Make More Videos Like This Please Donate Here:https://www.youtube.com/channel/UCq3hT5JPPKy87JGbDls_5BQ/joinGet some awesome Heavy Spoilers show clothes, phonecases and accessories at - https://teespring.com/en-GB/stores/deffinitions-storeReel Rejects Interview - https://www.youtube.com/watch?v=h0y3Y_v84ho*Check out our BEST new videos below**Black Summer Ending Explained* - https://www.youtube.com/watch?v=K3h8v8--hfk*Star Wars The Bad Batch Episode 8 Breakdown* - https://www.youtube.com/watch?v=xxdaJWKZcrw*Loki Episode 2 Breakdown* - https://www.youtube.com/watch?v=HW8tKKPDqD8*Spider-Man No Way Home Plot Details* - https://www.youtube.com/watch?v=7CHIHIlQgjA*New Batman Plot Details* - https://www.youtube.com/watch?v=l02E_lHO0D8*Sweet Tooth Comics Breakdown* - https://www.youtube.com/watch?v=ZO7J7Q0SEro/* ----- SOCIAL MEDIA ----- */Follow Me On Social Media At:TikTok - https://www.tiktok.com/@heavyspoilers?lang=enTwitter - https://twitter.com/heavyspoilersInstagram - https://www.instagram.com/heavyspoilers/Facebook - https://www.facebook.com/DeffinitionMC//* ----- VIDEO INFORMATION ----- */0:00 Loki Episode 3 Intro0:28 Episode 2 Sylvie Reveal1:13 Lady Loki Comic Origins3:35 Timestone3:55 Episode 3 Breakdown8:23 Reel Rejects Shoutout and Subcribe Bit9:10 Sylvie Old Loki Theory10:05 Episode 3 Easter Eggs12:53 Episode 4 Predictions14:17 Loki Review And ReactionNow the episode itself is called which means to lament, groan or weep in Latin. However beyond that in the comics it's a purple planet that we end up visiting in this episode.We open with the song Demons by Haley Kiyoko because...well we're dealing with horned gods. They also encounter a woman who calls them devils and devil imagery has of course been laced throughout the show.From here we jump to Sasha Lane's C-20 and Slyvie getting their drink on discussing brain freeze. Hilariously Sylvie doesn't suffer from this as we know that Loki is of course a frost giant and therefore wouldn't feel the cold.Throughout our breakdowns we've discussed how there may be other characters making cameo's as slight variants and in episode 1 it was of course Peggy Carter, Episode 2 had Agatha and shoutouts Christopher Godines on twitter for pointing out we get what might be a cameo of Evan Peter's in this bar.Reality warps around them as we see Sylvie attempt to get to the bottom of how many people are guarding the timekeepers which is revealed to be an illusion. Turns out this entire scenario is a pyshic projection which is actually another power that the Enchantress has.Cut to the title screen and shoutouts Patrick Currier for pointing out that this is actually an effect that you get when you photocopy something over and over again. This is known as Generation Loss and over time if you keep copying something the quality of it diminishes. Obviously, this speaks to the amount of variant Lokis that there are running around and at one point in the entry Loki even refers to Sylvie as a failed Photocopy.From Sylvie travels to the TVA headquarters but she's surprised to learn that her powers don't work meaning that she likely hasn't been there before or if she has that she wasn't in a position to use them. Interestingly though Loki is able to warp his daggers in and this could be because he ended up being placed in a trusted position by the TVA.Now this power set is very similar to Wanda who too did something similar to people when she infected their mind in age of ultron. This is clearly the skill set of a witch and there are things that hint to her being more of a combination of characters early on.Loki asks if she's sure she's a Loki, she says not to call her that and at one point he even utters the line Enchant me which....► Artist AttributionLofi Geek @Spotify: https://spoti.fi/3g16PgrLofi Geek Official Channel: https://www.youtube.com/channel/UCyD59CI7beJDU493glZpxgAArtwork @mb0sco"
"0sgk1sNUJR8","Golden Buzzer: Jimmie Herrod Surprises the Judges With Tomorrow - America's Got Talent 2021","2021-06-23T01:34:30Z","UCT2X19JJaJGUN7mrYuImANQ","America's Got Talent","24","21.24.06","Simon Cowell|Howie Mandel|Terry Crews|America's Got Talent|America's Got Talent Best|AGT|AGT Best Auditions|Heidi Klum|Sofia Vergara|Full Performance|AGT Auditions|Got Talent Auditions|America's Got Talent 2021|AGT 2021|Jimmie Herrod|Golden Buzzer|Annie|Tomorrow|from|Annie|Tomorrow|Tomorrow Cover|Golden Buzzer Jimmy|Jimmy|Sofia Vergara Golden Buzzer|Golden Buzzer America's Got Talent|Golden Buzzer 2021|agt golden buzzer|got talent golden buzzer","3978854","103133","1841","7183","https://i.ytimg.com/vi/0sgk1sNUJR8/default.jpg","False","False","Jimmie Herrod performs Simon Cowell's LEAST FAVORITE song in the world... and he slays it! Jimmie earns the Golden Buzzer from Sofia Vergara after singing an unbelievable rendition of Tomorrow from Annie. » Get The America's Got Talent App: http://bit.ly/AGTAppDownload» Subscribe for More: http://bit.ly/AGTSub» America's Got Talent Premieres Tuesdays 8/7c on NBC!» Stream on Peacock: https://pck.tv/3cCQGhHAMERICA'S GOT TALENT ON SOCIALLike AGT: https://www.facebook.com/agtFollow AGT: https://twitter.com/agtAGT Instagram: http://instagram.com/agtFind America's Got Talent trailers, full episode highlights, previews, promos, clips, and digital exclusives here.NBC ON SOCIAL:YouTube: http://www.youtube.com/nbcTwitter: http://Twitter.com/NBCFacebook: http://Facebook.com/NBCInstagram: http://instagram.com/nbcABOUT AMERICA'S GOT TALENTAmerica’s Got Talent, NBC’s No. 1 summer show, with fresh new faces and familiar favorites, along with the excitement, thrills and feel-good performances that viewers have come to love each season. Creator and Executive Producer Simon Cowell is back at the star-studded judges' table with fan-favorite comedian Howie Mandel. Acclaimed actress and international superstar Sofia Vergara joins as a new judge this season alongside returning judge and global fashion icon Heidi Klum.  The dynamic Terry Crews returns as host. With the show open to acts of all ages, America's Got Talent continues to celebrate the variety format like no other show on television. Year after year, America's Got Talent features an impressive array of singers, dancers, comedians, contortionists, impressionists, magicians, ventriloquists and hopeful stars, all vying to win America's hearts and a $1 million prize.America's Got Talent is available now on Peacock, the new streaming service from NBCUniversal. Watch thousands of hours of hit movies and shows, plus daily news, sports, and pop culture updates. Stream now on Peacock.Golden Buzzer: Jimmie Herrod Surprises the Judges With Tomorrow - America's Got Talent 2021https://youtu.be/0sgk1sNUJR8America's Got Talenthttp://www.youtube.com/user/americasgottalent#AGT #AmericasGotTalent"
