video_id,title,publishedAt,channelId,channelTitle,categoryId,trending_date,tags,view_count,likes,dislikes,comment_count,thumbnail_link,comments_disabled,ratings_disabled,description
"10nsi3fB5Z0","My Royal Guards | Ep. 2 | Minecraft Empires 1.17","2021-06-18T19:00:03Z","UCzTlXb7ivVzuFlugVCv3Kvg","LDShadowLady","20","21.24.06","ldshadowlady|minecraft|mini game|girl gamer|pink hair|funny|walkthrough|empires|smp|1.17|minecraft empires|empire","1837687","131729","719","23857","https://i.ytimg.com/vi/10nsi3fB5Z0/default.jpg","False","False","Please *boop* the like button if you enjoy the video! :)Get an LDShadowLady Youtooz figure: https://ldshadowlady.youtooz.comEmpires SMP is a 1.17 vanilla server with some other fun Minecraft Youtubers! Each player chooses a biome to rule over and builds their own empire.Dangthatsalongname: https://www.youtube.com/dangthatsalongnamefWhip: https://www.youtube.com/fwhipGeminiTay: https://www.youtube.com/GeminiTayMCKatherine Elizabeth: https://www.youtube.com/katherineelizabethgamingLDShadowlady: https://www.youtube.com/ldshadowladyMythicalSausage: https://www.youtube.com/TheMythicalSausagePearlescentMoon: https://youtube.com/c/PearlescentMoonPixlriffs: https://www.youtube.com/PixlriffsSmallishbeans: https://www.youtube.com/smallishbeansSolidarity: https://www.youtube.com/user/SolidarityGamingInvestigations by Kevin MacLeodLink: https://incompetech.filmmusic.io/song/3924-investigationsLicense: http://creativecommons.org/licenses/by/4.0/The Builder by Kevin MacLeodLink: https://incompetech.filmmusic.io/song/4484-the-builderLicense: http://creativecommons.org/licenses/by/4.0/Amazing Plan by Kevin MacLeodLink: https://incompetech.filmmusic.io/song/3358-amazing-planLicense: http://creativecommons.org/licenses/by/4.0/Sneaky Adventure by Kevin MacLeodLink: https://incompetech.filmmusic.io/song/4383-sneaky-adventureLicense: http://creativecommons.org/licenses/by/4.0/Sneaky Snitch by Kevin MacLeodLink: https://incompetech.filmmusic.io/song/4384-sneaky-snitchLicense: http://creativecommons.org/licenses/by/4.0/Scheming Weasel (faster version) Kevin MacLeod (incompetech.com)Licensed under Creative Commons: By Attribution 3.0 Licensehttp://creativecommons.org/licenses/by/3.0/FOLLOW ME HERE:Twitter: https://twitter.com/LDShadowLadyFacebook: https://www.facebook.com/LDShadowLadyFBInstagram: http://www.instagram.com/ldshadowladyTwitch: http://www.twitch.tv/ldshadowladyCheck out Joel's gaming channel:http://www.youtube.com/SmallishBeans"
"TjbiHveOpGs","Friday Night Funkin' But It's Anime Garcello & BF │ FNF ANIMATION","2021-06-19T14:48:27Z","UCdJeTnK3CDdp-Vs5kFMwF6g","Pol","1","21.24.06","Friday Night Funkin Anime|FNF Anime Garcello|Garcello vs Bf","3808671","186920","2390","10196","https://i.ytimg.com/vi/TjbiHveOpGs/default.jpg","False","False","Friday Night Funkin' But It's Anime Garcello vs BF Anime Duet - FadingJoin this channel to get access to perks:https://www.youtube.com/channel/UCdJeTnK3CDdp-Vs5kFMwF6g/joinSupport me here!https://www.patreon.com/polknhttps://ko-fi.com/polkun#​Mod by Atsuover & Rageminer:https://gamebanana.com/mods/166531Wallpaper art by: https://www.youtube.com/watch?v=uBqULbYrD7QRemix by Kamex by:https://www.youtube.com/watch?v=aKpkaJMi4GEFor Business inquiries:fpxzy111@gmail.comSocmedIG:https://www.instagram.com/poltrudeau/​​​FB:https://www.facebook.com/Poltrudeau​​#FridayNightFunkin #FridayNightFunkinAnimation #FnFAnimation"
"VGj0rzIE7Is","MINIMINTER REACTS TO KSI – Holiday [Official Music Video]","2021-06-19T17:58:20Z","UCjB_adDAIxOL8GA4Y4OCt8g","MM7Games","20","21.24.06","miniminter|mm7games|simon|random|sidemen","1200513","81065","625","1866","https://i.ytimg.com/vi/VGj0rzIE7Is/default.jpg","False","False","The Original: https://www.youtube.com/watch?v=gfHbg53ykPYPRE ORDER HIS ALBUM HERE: https://ksi.lnk.to/AllOverThePlaceMy twitter: https://goo.gl/ugsA1YMain Channel: https://www.youtube.com/miniminterIF YOU HAVE AN IDEA FOR A VIDEO, LET ME KNOW HERE: https://docs.google.com/forms/d/e/1FAIpQLScZd25ziP34yQSDoWKmYaCaFJooWNXn6kJchlbI4Xt3wMacnw/viewform?usp=sf_linkBecome A Member: https://www.youtube.com/user/MM7Games/joinSidemen Clothing: https://goo.gl/8RLHBRSidemen Channels:Josh: https://goo.gl/VgeDWXTobi: https://goo.gl/MqGC4KJJ: https://goo.gl/dxn9YWVik: https://goo.gl/9xLpVDEthan: https://goo.gl/5GBDTgHarry: https://goo.gl/nJHyMASidemen Book: https://goo.gl/wqFrjSMy PC: http://bit.ly/miniminterCustom Controller: http://bit.ly/SideCCUKHOW I RECORD MY GAMEPLAY: http://e.lga.to/mmWHERE I GET MY CHAIR: http://www.gtomegaracing.com/gt-omega-pro-racing-office-chair-red-and-black-leather?tracking=53917aeedad00Video uploaded bySimon/Miniminter/mm7games"
"VEct4GvTUjw","Magic prank on my husband😂 #shorts by Tsuriki Show","2021-06-21T04:00:07Z","UCymK_3BWUcoYVVf5D_GmACQ","Tsuriki Show","23","21.24.06","tsuriki show|vovanya|vova|anya|joke|humor|laugh|prank","7203666","253305","14408","1653","https://i.ytimg.com/vi/VEct4GvTUjw/default.jpg","False","False","Thank you for watching.Subscribe to Tsuriki Show!More of our videos on Instagram https://instagram.com/twiceofniceAnd a huge number of Short videos with Vova and Anya in our Tik Tok https://vm.tiktok.com/ZMeke4LVv/#tsurikishow #tiktok #vovanya"
"ORLbbRHBSq4","Your Grandma Is Being Bullied In Heaven","2021-06-19T17:38:47Z","UCYF1kiTFCcYPqGTqXKt3JJg","Papa Meat","22","21.24.06","meatcanyon|papameat|meatcanyon angels|meatcanyon grandma|shorts","335751","44208","689","1461","https://i.ytimg.com/vi/ORLbbRHBSq4/default.jpg","False","False","Lol your grandma's deadAnimation: Azronaut https://twitter.com/arzonaut?s=20"
"gfHbg53ykPY","KSI – Holiday [Official Music Video]","2021-06-18T12:00:11Z","UCVtFOytbRpEvzLjvqGG5gxQ","KSI","10","21.24.06","MusicVideo|WithLyrics|Lyrics|KSI new music|KSI Patience|YUNGBLUD|Polo g|KSI nathan dawe|Lighter|Anne-Marie|Don’tPlay|KSI killa killa|KSI Cap|KSI Houdini|KSI|Poppin|KSI Wake Up Call|KSI dissimulation|KSI logan paul|KSIolajidebt|KSI craig David|KSI craig david digital farm animals|KSI digital farm animals|baldski|ksi holiday|holiday ksi|holiday official music video|pop hotlist|oliva rodrigo type beat|billboard top 100|youtube music","9295695","796023","15242","79456","https://i.ytimg.com/vi/gfHbg53ykPY/default.jpg","False","False","PRE ORDER MY ALBUM HERE: https://ksi.lnk.to/AllOverThePlace MY SHOP: https://shopksi.com/ Stream KSI’s “Holiday” - https://Ksi.lnk.to/HolidayyvWatch more from All Over The Place: https://www.youtube.com/playlist?list=PLr2SXwjSsDgK-q3zBX0ze0DtBnXopu8GE Follow KSI Instagram: https://www.instagram.com/ksi/Facebook: https://www.facebook.com/KSIOlajidebt/Twitter: https://twitter.com/KSI?ref_src=twsrc...TikTok: https://www.tiktok.com/@ksi?lang=enSpotify: https://open.spotify.com/artist/1nzgt... Lyrics:  I wanna wake up every morning feeling better cos I know you’re sleeping by my sideAnd every moment we’re together I’ll remember just to keep it all for you and I I see that body in the sunlightFeeling the heat and it feels rightI wanna do this for the rest of my lifeOh, I know I know you know the vibe I wanna stay with you every nightYou and me underneath lightsI’m Always good when you’re by my side I know You know you’re on my mind You really make me come alive I wanna be here for the rest of my life Looking for sunraysNeeding them good daysFly me a way away, you’re my holiday Cool like the oceanLost in emotionFind me a way away, you’re my holiday Whenever you’re here it’s a good timeStrawberry shirts in the sunshineIce cold drinks till the moonlightYou’re my holiday I wanna stay up till the morning with you talking, just listen to the things you sayAnd everytime I’m in the middle of the city I imagine us so Far awayI see that body in the sunlightFeeling the heat and it feels rightI wanna do this for the rest of my lifeOh, I know You know you’re on my mind You really make me come alive I wanna be here for the rest of my lifeMusic Management: Mams Taylor - mams@properloud.comhttps://www.properloud.com/ Directed By Troy Roscoe - :https://www.instagram.com/troyroscoe/ RBC Records - https://rbcrecords.com/ BMG - https://www.bmg.com/us/  #Holiday #KSI #Pop"
"FNPp64dR8f8","Spies in Disguise - Death of a Studio","2021-06-19T17:03:56Z","UCApwcZw_xawOTzQFoYVOJmw","24 Frames Of Nick","24","21.24.06","nostalgia|netflix|willsmith|tomholland|animation|animatedmovies|spiesindisguise|familymovies|minions|universal|illumination|pixar|disney|fox|reviews|comedy|parody|schaffrillasproductions","683392","41882","465","2280","https://i.ytimg.com/vi/FNPp64dR8f8/default.jpg","False","False","Thanks to Keeps for sponsoring this video!Head to http://keeps.com/24frames to get 50% off your first order of hair loss treatment.Letterboxd: https://letterboxd.com/24framesofnick/Instagram: https://www.instagram.com/24framesofnick/Twitter: https://twitter.com/24framesofnick #24framesofnick"
"bYaGqRfxH_M","TELLING MY FAMILY & FRIENDS WE'RE PREGNANT! *crying*","2021-06-19T04:38:13Z","UCglkH4HcEdUBpLU65TDjYmg","The Renterias","22","21.24.06","mayratouchofglam|epicmunke|vlog|daily vlog|funny|viral|makeup artist|vlogger|family vlog|couple vlog|the renterias|therenterias|mayra and bryan|Bryan and mayra|Telling my family I’m pregnant|Telling my friends I’m pregnant|I’m pregnant|Telling my friends and family I’m pregnant","491707","26015","237","1677","https://i.ytimg.com/vi/bYaGqRfxH_M/default.jpg","False","False","https://riacases.comMy Beauty Channel:https://www.youtube.com/user/mayratouchofglamBryan's Channel:https://www.youtube.com/c/epicmunkeFOLLOW MEINSTAGRAM:mayratouchofglambryanrenteria_FACEBOOK:Mayra's Touch of GlamTWITTER:mytouchofglamSNAPCHAT: MytouchofglamxMUNKEx"
"CZJvBfoHDk0","Golden Buzzer: Nightbirde's Original Song Makes Simon Cowell Emotional - America's Got Talent 2021","2021-06-09T02:01:09Z","UCT2X19JJaJGUN7mrYuImANQ","America's Got Talent","24","21.24.06","Simon Cowell|Howie Mandel|Terry Crews|America's Got Talent|America's Got Talent Best|AGT|AGT Best Auditions|Heidi Klum|Sofia Vergara|New AGT|Full Performance|AGT Full Performances|Season 16|America's Got Talent Season 16|AGT 16|AGT Auditions|Got Talent Auditions|America's Got Talent 2021|AGT 2021|america's got talent auditions|golden buzzer|nightbirde|it's okay|Golden Buzzer|Golden Buzzer AGT|Golden Buzzer Cancer|Simon Cowell Golden Buzzer","23908362","753139","7043","48056","https://i.ytimg.com/vi/CZJvBfoHDk0/default.jpg","False","False","Simon Cowell gives Nightbirde the Golden Buzzer after her beautiful performance of It's Okay. Nightbirde chases her dreams and proves that she is so much more than her cancer! » Get The America's Got Talent App: http://bit.ly/AGTAppDownload» Subscribe for More: http://bit.ly/AGTSub» America's Got Talent Tuesdays 8/7c on NBC!» Stream on Peacock: https://pck.tv/3cCQGhHAMERICA'S GOT TALENT ON SOCIALLike AGT: https://www.facebook.com/agtFollow AGT: https://twitter.com/agtAGT Instagram: http://instagram.com/agtFind America's Got Talent trailers, full episode highlights, previews, promos, clips, and digital exclusives here.NBC ON SOCIAL:YouTube: http://www.youtube.com/nbcTwitter: http://Twitter.com/NBCFacebook: http://Facebook.com/NBCInstagram: http://instagram.com/nbcABOUT AMERICA'S GOT TALENTAmerica’s Got Talent, NBC’s No. 1 summer show, with fresh new faces and familiar favorites, along with the excitement, thrills and feel-good performances that viewers have come to love each season. Creator and Executive Producer Simon Cowell is back at the star-studded judges' table with fan-favorite comedian Howie Mandel. Acclaimed actress and international superstar Sofia Vergara joins as a new judge this season alongside returning judge and global fashion icon Heidi Klum.  The dynamic Terry Crews returns as host. With the show open to acts of all ages, America's Got Talent continues to celebrate the variety format like no other show on television. Year after year, America's Got Talent features an impressive array of singers, dancers, comedians, contortionists, impressionists, magicians, ventriloquists and hopeful stars, all vying to win America's hearts and a $1 million prize.America's Got Talent is available now on Peacock, the new streaming service from NBCUniversal. Watch thousands of hours of hit movies and shows, plus daily news, sports, and pop culture updates. Stream now on Peacock.Golden Buzzer: Nightbirde's Original Song Makes Simon Cowell Emotional - America's Got Talent 2021https://youtu.be/CZJvBfoHDk0America's Got Talenthttp://www.youtube.com/user/americasgottalent#AGT #AmericasGotTalent #Nightbirde #GoldenBuzzer"
"ECPwjRXcszQ","Talented People On Tik Tok Worth Watching","2021-06-19T20:17:03Z","UCpB959t8iPrxQWj7G6n0ctQ","SSSniperWolf","24","21.24.06","sssniperwolf|sniper wolf|reacting|reaction|funny|tiktok|tik tok|talented people|people|talent|talented|tik tok talent|tik toks worth watching","5356427","164612","2223","11995","https://i.ytimg.com/vi/ECPwjRXcszQ/default.jpg","False","False","Talented People On Tik Tok Worth Watching! Leave a Like if you enjoyed and comment if you have any talents! Watch the last tiktok vid https://youtu.be/4dcl6iYxQlI Subscribe to SSSniperWolf to join the Wolf Pack http://bit.ly/SubSSSniperWolfTikTok: http://tiktok.com/@sssniperwolfInstagram: http://instagram.com/sssniperwolfTwitter: http://www.twitter.com/sssniperwolfFacebook: https://www.facebook.com/sssniperwolfOfficial Merch: https://ogwolfpack.com/"
"DAfXft7i0P8","How I Survived My First Pokémon Nuzlocke","2021-06-18T18:00:11Z","UCBODyKF0JMbUd6D9Bklyzbw","Alpharad","20","21.24.06","alpharad|super smash bros ultimate|smash bros|not|not alpharad|alpharad smash|nintendo|nintendo switch|pokemon|alpharad pokemon|pokemon firered|nuzlocke|pokemon nuzlocke|alpharad nuzlocke","1141487","85656","682","6625","https://i.ytimg.com/vi/DAfXft7i0P8/default.jpg","False","False","Believe it or not, but I've never actually attempted a Pokémon nuzlocke before... so what could possibly go wrong?➤ SUBSCRIBE FOR MORE: http://bit.ly/Sub2Alpharad➤ TWITTER: https://twitter.com/alpharad➤ INSTAGRAM: https://www.instagram.com/alpharad➤ BECOME A MEMBER (and see early videos): https://www.youtube.com/channel/UCBODyKF0JMbUd6D9Bklyzbw/join-----------------------------DIRECTOR / EDITOR➤  Jacob Rabon IV (Alpharad)WRITERS➤  Jacob Rabon IV (Alpharad)➤  @Jo Sniffy (Josniff) of @Alpharad DeluxeManga Artist➤  Bobber: http://twitter.com/bobberwccGraphic Designers➤  Crystel: http://twitter.com/crystei➤  Aster: http://twitter.com/asteryiaThumbnail Artist➤  Nova: http://twitter.com/nova1dukeOrange Justice Animator➤ Maellon: http://twitter.com/MMMaellonGuest Appearances from friends!Captain Kidd, Altrive, Keely, Jawsh, Failboat, Fyrus, Jome, Smith, Faye Mata, Kwehzy, JaidenAnimations, and Aaronitmar!!#Pokemon #Nuzlocke #Alpharad-----------------------------➤ Music Used:Pokémon Let's Go Pikachu and Eevee Soundtrack: https://www.youtube.com/playlist?list=PLQk-zlQhXjP1fHKj9BY93RcsUDcEQrglYPokémon Sword and Shield Soundtrack: https://www.youtube.com/playlist?list=PLxdQfrU9eTcM-UoPaRH8yCyFW1BArfrs_One Piece - We Are (Orchestral): https://www.youtube.com/watch?v=DyxQnF0cZh4JJBA Yoshikage Kira Theme: https://www.youtube.com/watch?v=9yGGNohmAT0PMD2 Don't Ever Forget: https://www.youtube.com/watch?v=mH_Zl2Rgl5MBalrog's Theme Remix: https://www.youtube.com/watch?v=Dpz98_qZTiAStep Subspace: https://www.youtube.com/watch?v=A-Ky7QFh72kPMD2 Don't Ever Forget (Orchestral): https://www.youtube.com/watch?v=6MnhlhoYQ7YOne Piece - We Go / We Are (Stampede Orchestra Ver.): https://www.youtube.com/watch?v=YZh1qzjM8PIGotta Catch Em All (Synthesia): https://www.youtube.com/watch?v=yPGr-R1HUG8SPM Tokens, Please: https://www.youtube.com/watch?v=kqbfPicBdtICeleste's Anxiety: https://www.youtube.com/watch?v=FMuQ11tVJnkI Want To Live (PW4): https://www.youtube.com/watch?v=RqgovHw4yYgJJBA Caesar Theme: https://www.youtube.com/watch?v=4d5mpIyJn14&"
"1RyF1qBwoqA","Friday Night Funkin' - VS Bob Remastered FULL WEEK + Cutscenes (FNF Mod/Hard) (Ballistic Mode)","2021-06-21T12:11:21Z","UCsJjXWCFZcDn-IAghR--S_A","CommunityGame","20","21.24.06","Friday Night Funkin|Boyfriend|Girlfriend|Tankman|Pico|Newgrounds|Week 7|Ninjamuffin99|Ugh|FNF|week 7|dialogue|Music|CommunityGame|GameAtHeart|sky|mod|fnf new week|ruv|mid fight masses|Selever|Sarv|Mod|Hero|Custom Songs|Custom|tricky|stareclown|matt|Trollge|fnf custom week|Bob mod fnf|Bob mod fnf remastered|Sketchy|Bob|vs Bob|vs Bob remastered|phase|Bob full week|friday night funkin Bob|Bob 2.0|2.0|tabi|whitty|Ballistic|fnf bob run|fnf bob is mad","1441988","30081","932","5063","https://i.ytimg.com/vi/1RyF1qBwoqA/default.jpg","False","False","Friday Night Funkin' VS Bob Remastered (FULL WEEK) for the PC in 2160p Ultra HD, but this time we battle a Remaster Bob that has the power to mess with your game and spam so many arrows. We'll be playing it on very hard mode for all VS Bob Remastered songs. He has 3 songs available in this mod, epic cutscenes, and only 1 week.Game Note: Uh Oh, the man Bob is angry and you made them angry and they are so angry man, what did you do to make them angry? Honestly don’t know I’m just a game description.Some parts of the Bob mod close the game unexpectedly and trigger a link to open. Only enter if you dare.All Songs from Friday Night Funkin' VS Bob Remastered Full Week Mod Timestamp:00:00 Bob Remaster Animation00:11 Bob Intro00:38 Cutscenes Dialogue 101:03 Sunshine Song (Bob Remastered Vs Boyfriend)02:24 Cutscenes Dialogue 202:52 Reloading - This may take a while03:14 Withered Song  (Bob Remastered Vs Boyfriend)04:49 Cutscenes Dialogue 306:03 Run Song  (Bob Remastered Vs Boyfriend & Girlfriend)07:07 Bob's Game Over Screen07:13 Bob Is Mad07:26 Bob Easter Egg Music Player07:53 Bob image Easter Egg07:57 Umm I'm outMod Creators for VS Bob Remastered (literally every fnf mod ever) below VS Bob Remastered FULL WEEK (Cutscenes!) Mod Download link: https://gamebanana.com/mods/296986Artist by ZalMods:https://gamebanana.com/members/1917419Literally every fnf mod ever (Vs Bob Week) Download:https://gamebanana.com/mods/285296Coder, animator & kickstarted the project for original bob wildy thomas:https://twitter.com/wildythomas1233original concept, mod helper and asset maker by phloxio:https://twitter.com/Donna863_kade engine by KadeDeveloper: https://twitter.com/KadeDeveloperGet the game and support the creators of the game:https://ninja-muffin24.itch.io/funkinhttps://www.newgrounds.com/portal/view/770371Friday Night Funkin': The Full Ass Game: https://www.kickstarter.com/projects/funkin/friday-night-funkin-the-full-ass-gameFriday Night Funkin' - WEEK 7 All Tankman Death Quotes & Game Over Screens:https://youtu.be/n8ROKNI2M8cFriday Night Funkin' Pico's School Editionhttps://youtu.be/d0pLWxwHz3QFRIDAY NIGHT FUNKIN’ Full Game, but The Mom Sings it:https://youtu.be/YS6fhhJsC8YShaggy 2.0 Vs. Shaggy Remastered: https://youtu.be/6BQLCLVtBLEFriday Night Funkin' gameplay @ 1080p 60fps & 4k HD by CommunityGame (2021)Rate & Subscribe To CommunityGame#FridayNightFunkin #FnF #VSBob #Bob #BobRemastered #tricky #CommunityGame---------------------------------➤ FACEBOOK: http://www.facebook.com/CommunityGameHQ➤ TWITTER: https://twitter.com/#!/CommunityGameHQ➤ INSTAGRAM: https://www.instagram.com/communitygame_hq/➤ SITE: https://www.communitygamehq.com/"
"nO9x-bRitcY","My Pet Seagull made the cover of a fitness magazine","2021-06-21T13:23:02Z","UCpOOxojfWdfzZhCwiHAW4qg","Feeding Steven","15","21.24.06","birds|funny birds|funny animals|talking animals|talking birds|birds talking|seagull|funny seagull|seagull tiktok|talking seagull|feeding birds|feeding seagull|bird vlog|pet bird|talking pets|funny pets|viral pets|viral animals","212609","19731","170","264","https://i.ytimg.com/vi/nO9x-bRitcY/default.jpg","False","False","new merch ⬇️https://linktr.ee/feedingsteven#tiktok #seagull #shorts"
"TToMr95Zt6s","DDG & OG Parker - Hood Melody ft. YoungBoy Never Broke Again (Official Music Video)","2021-06-17T19:00:11Z","UC9OAeZY8zp976DwRvHGjuSA","DDGVEVO","10","21.24.06","ddg|queen naija|pontiacmade|sorry 4 the hold up|arguments|pontiac|michigan|rap|run it up|take me serious|DDG YouTube|Lil Baby|Too Much To Lose|Young Rich Black|Accountant|BlocBoy JB|Jay Critch|VALEDICTORIAN|meet me in the lobby|toxic|exotics|she cheated|moonwalking in calabasas|remix|moonwalking in calabasas remix|salim montari|salim montari remix|carnage|carnage remix|og parker|ddg x og parker|42 dugg","3200492","223561","1753","17820","https://i.ytimg.com/vi/TToMr95Zt6s/default.jpg","False","False","DDG & OG Parker - Hood Melody ft. YoungBoy Never Broke Again (Official Music Video)Die 4 Respect available at: https://DDG.lnk.to/Die4RespectHood Melody Official Audio: https://youtu.be/LQo53hPiUBIFollow DDG:https://twitter.com/pontiacmadeddg https://www.facebook.com/Pontiacmadeddg/ https://www.instagram.com/pontiacmadeddg https://soundcloud.com/pontiacmadeddg https://www.youtube.com/channel/UCKqqDlf6lfo3ChRA4-gzusQFollow OG Parker:https://www.instagram.com/ogxparker/(C) 2021 DDG Entertainment Inc., under exclusive license to Epic Records, a division of Sony Music Entertainment#DDG #OGParker #YoungBoyNeverBrokeAgain #HoodMelody #Die4Respect"
"Kq0M4_FDgT8","The Milwaukee Bucks Eliminate The Brooklyn Nets In A Wild Overtime Game 7 | NBA on TNT","2021-06-20T06:02:25Z","UCU7iRrk3xfpUk0R6VdyC1Ow","NBA on TNT","17","21.24.06","NBA on TNT|NBA|Inside the NBA|Charles Barkley|Shaq|Kenny Smith|Ernie Johnson|Milwaukee Bucks|Bucks|Milwaukee|Brooklyn Nets|Nets|Brooklyn|Eastern Conference Finals|ECF|Giannis|KD|Durant|Kevin Durant|NBA Playoffs|Playoffs|Game 7|OverTime|Game 7 OT|KD shot","957698","12384","287","1969","https://i.ytimg.com/vi/Kq0M4_FDgT8/default.jpg","False","False","The Inside crew reacts to Giannis and the Bucks outlasting KD and the Nets in OT to advance to the Eastern Conference Finals. Watch highlights from Inside the NBA with Shaq, Charles Barkley, Kenny Smith and Ernie Johnson and more! Subscribe now to be updated on the latest videos: https://www.youtube.com/nbaontnt?sub_confirmation=1Connect with NBA on TNT:Follow NBA on TNT on Twitter: https://twitter.com/NBAonTNTLike NBA on TNT on Facebook: https://www.facebook.com/NBAONTNT/Follow NBA on TNT on Instagram: https://www.instagram.com/nbaontnt/?hl=en"
"C2AFf9wSAdM","Rick and Morty | Season 5 Premiere Cold Open: Morty Meets Rick's Nemesis | adult swim","2021-06-18T14:00:05Z","UCgPClNr5VSYC3syrDUIlzLw","Adult Swim","24","21.24.06","adult swim|animation|adult animation|comedy|animated|funny|animated series|comedy series|watch adult swim|watch animation|watch comedy|animated show|adult swim official|animation series|Rick and Morty|Rick & Morty|Season 5|Rick and Morty Season 5|Watch Rick and Morty|watch|Dan Harmon|Justin Roiland|Rick Sanchez|adult cartoon|science fiction|sci-fi|adventure|sitcom|scientist|multiverse|Morty Smith|Rick and Morty episodes|sneak peek|Mr Nimbus|nemesis","4702634","174491","1166","5822","https://i.ytimg.com/vi/C2AFf9wSAdM/default.jpg","False","False","His name is Mr. Nimbus. Rick and Morty return for season 5 on Sunday, June 20 at 11pm on Adult Swim.#AdultSwim #RickAndMorty SUBSCRIBE: http://bit.ly/AdultSwimSubscribe​What to watch next: more Rick and Morty clips!https://youtube.com/playlist?list=PLQl8zBB7bPvI_iYCe4LT8HHfjonOog4u3Find Rick and Morty on Adult Swim:https://www.adultswim.com/videos/rick-and-morty Stream seasons 1-4 on HBO Max.About Adult Swim:Get your Adult Swim fix whenever and wherever you want at www.adultswim.com, or by downloading the Adult Swim app. Binge marathons or watch selected episodes of many of your favorite shows including Rick and Morty, Robot Chicken, Venture Bros., Aqua Teen Hunger Force and many more. Connect with Adult Swim Online:Download the APPS: http://www.adultswim.com/apps/​Visit Adult Swim WEBSITE: http://www.adultswim.com​ Like Adult Swim on FACEBOOK: http://bit.ly/ASFacebook​Follow Adult Swim on TWITTER: http://bit.ly/ASTweet​Follow Adult Swim on INSTAGRAM: http://instagram.com/adultswimWatch Adult Swim in your country:United Kingdom: https://bit.ly/AS_UKRepublic of Ireland: https://bit.ly/AS_UKFrance: https://bit.ly/AS_FRSpain: https://bit.ly/AS_SPAGermany: https://bit.ly/AS_GESweden: https://bit.ly/AS_NORDICNorway: https://bit.ly/AS_NORDICDenmark: https://bit.ly/AS_NORDICFinland: https://bit.ly/AS_NORDICSouth Africa: https://bit.ly/AS_SARick and Morty | Season 5 Premiere Sneak Peek: Morty Meets Rick's Nemesis | adult swim"
